ID,Date_utc,Author,Body,Submission,Parent_ID,Parent_Author,Level,Subreddit
h9ek3ma,1629291389.0,Phyredanse,"Here's a thought experiment for you. (Disclaimer: This is a thought experiment. It is a ""What If?"" and therefore highly theoretical, hardly practicable, and in no way verified. I'm neither claiming this to be true nor something I actually believe. You must research this yourself. Slide down the rabbit hole at your own risk and discretion. I make no claims of safety or sense. Thank you.)

What if the vaccine is a means for specific effects of the virus to be perpetuated indefinitely?

There was a recent advanced study released by researchers at Harvard and MIT showing that covid, unlike most other viruses, can become genomic in humans. This was studied after people were still testing positive months after their infection had cleared. The viral RNA was transposed back into the genomic DNA due to a specific functional pathway relating to mRNA. It could be speculated that this is part of the picture behind long-term covid, but that's secondary to this discussion.

The specific part of the covid RNA that was observed to become genomic after infection was related up the spike protein. The RNA related to the spike protein is the viral RNA used in the mRNA vaccines. 

Since the virus itself has shown evidence of becoming genomic in humans, specifically through the transposition of this particular chunk of RNA, AND the mRNA vaccines use the same chunk of RNA and the same biological and genetic mechanisms to relay the viral protections they afford, WHAT IF the vaccine creates the same long term effects in the inoculated? Further, since it potentially becomes genomic, could this be an epigenetic event that alters human genomic DNA for future generations? 

Considering that data has already shown high viral concentrations in certain reproductive organs (specifically the ovaries), there is a higher than not chance that any alterations to the genome would be passed down genetically to any offspring.

Again... I'm just thinking out loud, so to speak. This thought experiment merely piggy-backs off of OP's wild speculation, just leading us further out into deep water. There is no scientific validation I am aware of for any leaps of logic in this comment other than the vague ideas specifically outlined here. It is purely speculation and should not be considered advice of any kind.",p6l30d,p6l30d,,1,conspiracytheories
h9efopi,1629288710.0,Muno11,It’s pretty funny That you say «Covid is a hoax» is something not based in science when the virus literally hasn’t been isolated for the public eye to see 😂,p6l30d,p6l30d,,1,conspiracytheories
h9el41e,1629291952.0,lovethejuiceofit,It was isolated by the CDC and has been distributed to researchers for a year and a half now.,p6l30d,h9efopi,Muno11,2,conspiracytheories
h9elm3t,1629292230.0,Benegger85,"Yes it has...

They even sequenced it's genetic code",p6l30d,h9efopi,Muno11,2,conspiracytheories
h9ebt5l,1629286043.0,memphisproud,Yes you are right they identifie as the liberal left.,p6l30d,p6l30d,,1,conspiracytheories
h9eeux5,1629288169.0,FwdBluejay1331,"Jesus christ this fake ass astrotutfing anti conservative ""comment"" needs to jump off a cliff.",p6l30d,p6l30d,,1,conspiracytheories
h9eghqm,1629289224.0,GirlNumber20,You sound triggered.,p6l30d,h9eeux5,FwdBluejay1331,2,conspiracytheories
h9eg3od,1629288981.0,rockyjack793,I would have to say the liberals are doing this more than conservatives. Most conservators would just rather it disappear,p6l30d,p6l30d,,1,conspiracytheories
h9emj5e,1629292721.0,Benegger85,"Liberals are the one actually fighting the virus, by getting people vaccinated and limiting the spread of it with social distancing and mask mandates.

Conservatives are blocking all efforts to contain the virus.",p6l30d,h9eg3od,rockyjack793,2,conspiracytheories
h9eqda8,1629294656.0,shredler,">would just rather it disappear. 

Who fucking doesnt want this to go away? But you have to address the problem and do the fucking work to get it handled. You cant just close your eyes and ears about a problem deny it even exists, and pray it away. The conservative response to covid has been a fucking hypocritical JOKE.",p6l30d,h9eg3od,rockyjack793,2,conspiracytheories
h9egda3,1629289147.0,apolloanthony,"Healthcare workers/Hospitals, pharma companies, and PPE/medical device manufacturers stand to profit a ton from this. Not just $, but power and influence.",p6l30d,p6l30d,,1,conspiracytheories
h9eiq1v,1629290589.0,KreekWhydenson,Heard immunity.....,p6l30d,p6l30d,,1,conspiracytheories
h9emsjc,1629292854.0,Benegger85,We are still far from that...,p6l30d,h9eiq1v,KreekWhydenson,2,conspiracytheories
h9bw2dk,1629231804.0,,[removed],p6bm7w,p6bm7w,Stilly_Albatross,1,conspiracytheories
h9bxah1,1629232312.0,AncientKnowledgeX,What’s up with your copy and paste spam posts?,p6bm7w,p6bm7w,Stilly_Albatross,1,conspiracytheories
h9bhnk8,1629225779.0,slipknot_official,"2,000 troops out of a 1.5 million globally were pulled from Afghanistan. 

No need to worry.",p69k3f,p69k3f,,1,conspiracytheories
h9bi45n,1629225977.0,delusionalfoodman,There’s no shortage of troops at home lol,p69k3f,p69k3f,,1,conspiracytheories
h9bh31o,1629225533.0,delusionalfoodman,So I read this in its entirety and am now significantly stupider.,p6946x,p6946x,,1,conspiracytheories
h9bky2r,1629227186.0,elmataculos420,"You're too brainwashed to understand what's going on. Wake the fuck up, lame fuck.",p6946x,h9bh31o,delusionalfoodman,2,conspiracytheories
h9bp6kx,1629228984.0,Fnordpocalypse,"No one is getting magnetized from vaccines.

There’s no “big talk” about it, just people with a weak grasp of science getting more attention than they deserve.",p6946x,p6946x,,1,conspiracytheories
h9bhxb8,1629225896.0,louhepburn1219,"Tell me you have absolutley no understanding of science, without telling me you have absolutley no understanding of science.",p6946x,p6946x,,1,conspiracytheories
h9bks0r,1629227114.0,elmataculos420,You're a retard. Lmao wake the fuck up. Look Into it,p6946x,h9bhxb8,louhepburn1219,2,conspiracytheories
h9dbhe6,1629256763.0,Kenma2019,"This guy summed my thoughts to the magnetism theory faster than anyone else.

https://youtu.be/RRkaWQJFkBQ",p6946x,p6946x,,1,conspiracytheories
h9dcdp4,1629257275.0,thesonofGodsaves,"Look, it's patently obvious why you'd be magnetized. How else will the harvester ships be able to pluck up all the humans into the food processing bays, using their giant magnetometers? 😎👽🛸",p6946x,p6946x,,1,conspiracytheories
h9bkohi,1629227073.0,elmataculos420,So many brainwashed retards. Everything you said is completely true. People are just afraid to wake up to the truth. It's literally a Spiritual War going on.,p6946x,p6946x,,1,conspiracytheories
h9bhwkq,1629225887.0,No_Description_3504,Seems like your on the track there,p6946x,p6946x,,1,conspiracytheories
h9az2hh,1629216152.0,jutathemagnificent,"I'm looking for stats for deaths by covid vaccine, so far in UK, no deaths, not child nor adult",p66alo,p66alo,kam_hd01,1,conspiracytheories
h9b21ta,1629217318.0,justjonesi,This is peak Facebook “meme lord” type shit.  LOL. This guys got it figured out for sure.,p66alo,p66alo,kam_hd01,1,conspiracytheories
h9b0taw,1629216834.0,Chariballs,"Children under a certain age can't even be vaccinated with the covid vaccines. 

Classic anti vax propaganda, next.",p66alo,p66alo,kam_hd01,1,conspiracytheories
h9axht4,1629215535.0,Unplugged_420,"So tired of seeing this shit, take it or don’t just be consistent. Most the people out there complain about FDA approval and then proceed to take non FDA approved vitamins, supplements and recreational drugs etc..",p66alo,p66alo,kam_hd01,1,conspiracytheories
h9ba4zz,1629221532.0,Chariballs,This is a shit post if I ever saw one. Doesn't belong in this sub.,p66alo,p66alo,kam_hd01,1,conspiracytheories
h9azr72,1629216417.0,,I joined this sub hoping for some reptiles running the gov. Or aliens built the pyramids type shit.,p66alo,p66alo,kam_hd01,1,conspiracytheories
h9ayk0q,1629215950.0,,[removed],p66alo,p66alo,kam_hd01,1,conspiracytheories
h9axnp1,1629215597.0,bruggernaut16,Dumbest shit I’ve seen so far today.,p66alo,p66alo,kam_hd01,1,conspiracytheories
h9b4n2r,1629218334.0,Fishtoots,Then don’t use doctors or hospitals at all. Stick to your herbs and spices to clear your mumps and measles Karen. Leave the rest of civilized modern society and make your exit. We’re truly tired of having you.,p66alo,p66alo,kam_hd01,1,conspiracytheories
h9b6d8x,1629219098.0,kam_hd01,Never had either so I guess I'll be fine lol,p66alo,h9b4n2r,Fishtoots,2,conspiracytheories
h9b45bq,1629218143.0,RedRust,"Whats the difference between a pig, a hog, or a boar?",p66alo,p66alo,kam_hd01,1,conspiracytheories
h9ax9r4,1629215446.0,ThatOneApe420,"Get this shit out of here, go back to r/conspiracy",p66alo,p66alo,kam_hd01,1,conspiracytheories
h9axjui,1629215557.0,Cynbolic,Yeah we’ve all heard about the hospitals filling up with children dying from the vaccine…… oh wait I’m sorry that’s children who DID NOT get the vaccine that are getting hospitalized 🤦‍♀️,p66alo,p66alo,kam_hd01,1,conspiracytheories
h9b6hcq,1629219152.0,reevoknows,"The vaccines are FDA approved for immunocompromised people and they are on track to be FDA approved by the fall.

If you don’t wanna take the vaccine that’s fine but spreading this shit on the internet. Just say you’re waiting to see the long term effects of the  vaccine and move on. Some people have loved ones who they are trying to protect. If it was every man for themselves I’m sure the vaccinated numbers would be lower. 

Remember the Spanish flu? Wanna know how they solved the Spanish flu? They just let everyone die who couldn’t handle it. That’s for sure an option lol but we have the technology now that we didn’t have in 1918. If they had the technology to produce a vaccine dont you think they would have? Of course they would. Penicillin wasn’t even invented until 1928 you stooge. 

50 million people died during the Spanish flu pandemic. Why are you so comfortable taking a chance that you and your loved ones immune system is strong enough to combat this virus? If you got your parents sick and they died how would you feel? 

Keep your garbage opinions to yourself and stop spreading bullshit on the internet. If I see more of this shit on the sub I’m out. I’m hoping this doesn’t turn into r/conspiracy, why don’t you go post this there and you can have an anti-vax circle jerk and talk about how much smarter you all are than everyone else. Christ.",p66alo,p66alo,kam_hd01,1,conspiracytheories
h9biec6,1629226099.0,Santafe2008,"Plus the world has 4 times the population as 1919....so, a cool 200,000,000 million deaths aughta cover it",p66alo,h9b6hcq,reevoknows,2,conspiracytheories
h9awfzz,1629215123.0,,[deleted],p66alo,p66alo,kam_hd01,1,conspiracytheories
h9b6me2,1629219220.0,scoutthespiritOG,"Studies have determined that the vaccine can potentially cause  blood clots that the body cannot repair, the clots keep building until the heart fails. This can happen because of a technology they have developed since the early 2000's called mnp's (magnetic nano particles) these mnps have never been used in humans until now. in layman's terms they're intended use is to draw the virus to a localized points within the body and then terminate the virus, only problem is that research has shown that after the virus dies the body has no way of ridding itself of these mnp's, so they end up becoming stagnant in the blood stream and build up into clots. When the technology first came out it was thought to be ok to use in small quantities however with covid the mnp's are being administered through the vaccine in huge quantities. Once in the blood stream the human body has no way of ridding itself of these nano particles because they are man made and thus will stay in your body until death. Researchers have even determined that because of the inability to leave our body these mnps can put you at a higher risk of developing cancer later in life. Im no scientist so i know it sounds dumb the way im writing but please just do your research before calling another person stupid because they disagree with the news and the government. No im not going to put sources because im not here to write a paper and go hunting for sources after i just woke up. So do your own research and remember that when someone disagrees with you its not because they are an idiot, but because they have read or seen or heard or experienced things you might haven't that has given them a different perspective. Personally i knew two people who died only about a week after getting both vaccines, both from heart failures. Also there has been deaths from the vaccine all over the country but again you have to research, and don't rely only on major news outlets and especially not the government.",p66alo,p66alo,kam_hd01,1,conspiracytheories
h9bjsyp,1629226701.0,Santafe2008,"Well, your statement about nano particles never being used on humans is just plain bs. They have been using them for cell isolation diagnostic testing, such as MRI'S.

That took 5 minutes to find. 

I highly doubt you know 2 people who died due to a side effect. I'm sure your ""Research"" is from highly reputable you tube presenters and people with degrees in absolutely nothing related to vaccines.",p66alo,h9b6me2,scoutthespiritOG,2,conspiracytheories
h9avucd,1629214887.0,,[deleted],p66alo,p66alo,kam_hd01,1,conspiracytheories
h9bmuuh,1629227999.0,poppingtabs,"It was time to reset the game peices. I think we know exactly what we are doing. Deals was made and executed even if it was with trump. It's still the U.S government. They say it's time to focus on Syria and Libya but Taiwan just might be the next big show. China says hey we coming and the U.S will back down. Funny how a chinese military satellite just hit some space junk supposedly from a russian rocket. I think all the superpowers of the world think 10 steps ahead, nothing can be left to chance in this game. Just my opinion though.",p667qy,p667qy,butthonkerthestomper,1,conspiracytheories
h9bs7mm,1629230240.0,Cattywappuss,"Lmao, off topic, but I read your username as “poopingtabs” and had some questions 😂",p667qy,h9bmuuh,poppingtabs,2,conspiracytheories
h9awxmm,1629215315.0,ZakTSK,It's cause we got the ghost of Osama Bin Laden finally,p667qy,p667qy,butthonkerthestomper,1,conspiracytheories
h9az26y,1629216149.0,Vetty1205,We didn't pull out suddenly. It's been going on for a few months now. They knew we were leaving. Trump is actually the one who made the agreement with them that we'd leave beginning May 1. Biden just continued the action.,p667qy,p667qy,butthonkerthestomper,1,conspiracytheories
h9dcxga,1629257591.0,butthonkerthestomper,Is that why there’s Americans stranded there? You’d think there would have been some advance notice if they were planning this for so long...,p667qy,h9az26y,Vetty1205,2,conspiracytheories
h9fise4,1629307550.0,SamDaMan97,"Not gonna lie, you kept me up last night with this one. To be honest, with the United States government backing down from Operation Iron Tempest back in 2019, and China's sudden cozying up to the Taliban's regime, I can see fertile ground for most of the theory.

They've gotta play ball with the Taliban, present themselves as a friend, and then gradually milk them for their opium. 

I think you got into some odd territory when you inserted Covid into your theory, but I have moved to make some sense of it.

There are a number of reports of drug shortages in the United States since the pandemic hit, some of these drugs being morphine and fentanyl, both opioids.

The end result? China gets an economic boon, and we get our medicine. 

So, I wouldn't completely discount it.",p667qy,p667qy,butthonkerthestomper,1,conspiracytheories
h9j3vol,1629379731.0,RichardButteMD,this is so on point i’m at a loss for words,p667qy,p667qy,butthonkerthestomper,1,conspiracytheories
h9mjb6i,1629434807.0,RedRust,Rip OP,p667qy,p667qy,butthonkerthestomper,1,conspiracytheories
h9qhp8r,1629508129.0,butthonkerthestomper,The FBI already knocked on my front door,p667qy,h9mjb6i,RedRust,2,conspiracytheories
h9qxw0h,1629516152.0,bugeaterboi,I think China and USA on the same team. Team billionaire,p667qy,p667qy,butthonkerthestomper,1,conspiracytheories
h9akc4t,1629210115.0,tscello,na,p64dnw,p64dnw,,1,conspiracytheories
h943t8a,1629084440.0,Healthy_Husky_Guy,No point in living in fear,p581hx,p581hx,,1,conspiracytheories
h943w3u,1629084483.0,King_Illager,True but it just feels like we are missing something and that scares me.,p581hx,h943t8a,Healthy_Husky_Guy,2,conspiracytheories
h945rpy,1629085507.0,WowSuchName619,Before it’s too late lol,p581hx,p581hx,,1,conspiracytheories
h947vyy,1629086720.0,King_Illager,Bit much?,p581hx,h945rpy,WowSuchName619,2,conspiracytheories
h9489u7,1629086945.0,Lonely-Wash9978,LoL I was thinking the same thing. Grammar check!,p581hx,h945rpy,WowSuchName619,2,conspiracytheories
h9482j2,1629086826.0,Jakbo_,Exactly what they've programmed you to think ..,p581hx,p581hx,,1,conspiracytheories
h94d9hr,1629089999.0,Allnewsisfakenews,"Relax. The virus is bad but we are lucky it isn’t that deadly. Since it isn’t, that’s why it’s staying around so long.",p581hx,p581hx,,1,conspiracytheories
h94dc8d,1629090048.0,King_Illager,True i guess.,p581hx,h94d9hr,Allnewsisfakenews,2,conspiracytheories
h94509y,1629085087.0,PickyEnglishTeacher,*than,p581hx,p581hx,,1,conspiracytheories
h94d8ac,1629089977.0,King_Illager,Ablest. I have dyslexia,p581hx,h94509y,PickyEnglishTeacher,2,conspiracytheories
h9494df,1629087445.0,Lonely-Wash9978,"I think you should do some research instead of assuming your conjectures on this are reality.

For one, it is nowhere anywhere near as dangerous as the black plague, absolutely no comparison. The black plague killed HALF OF EUROPE'S POPULATION. Coronavirus kills around 3 to at most 7% of people that contract it. The numbers are literally nowhere near each other. 

Also, I can't believe people are still spreading this hillbilly idea the virus was made in a laboratory in china. If you do any research, at all, you would find that there have been types of coronavirus in different places around the world for many years now, and covid-19 is just one mutation of coronavirus that got really bad, first, in China. 

Please, before spreading misinformation online that you heard at the local bar, read an article. Read a book. Do anything besides avidly spreading misinformation when you have no idea what it is you're talking about.",p581hx,p581hx,,1,conspiracytheories
h94bqgm,1629089027.0,King_Illager,"I thought this was a place to spread dumb Conspiracy theorys? Did I get the wrong sub?
My bad....",p581hx,h9494df,Lonely-Wash9978,2,conspiracytheories
h8ztoqw,1629001400.0,meltingonflapjacks,Who would even want to go here ?,p4mfos,p4mfos,BillyBerigman,1,conspiracytheories
h8zva8b,1629002386.0,BillyBerigman,"want? who the fuck thinks your wants have anything to do with it.

They will take your property at you from gun point if it is nice saying (its to hold the infected)

as for the ""infected"" they will be taken where they can be killed.

It is all about stealing property and murdering people.",p4mfos,h8ztoqw,meltingonflapjacks,2,conspiracytheories
h8zsk04,1629000711.0,Shot_Boysenberry_232,I wonder if all them fema camps will be used as well as all those plastic fema coffins.,p4mfos,p4mfos,BillyBerigman,1,conspiracytheories
h8zuu3r,1629002108.0,BillyBerigman,They planned on using this back in 2000 but... the internet came out and put their plans on hold...,p4mfos,h8zsk04,Shot_Boysenberry_232,2,conspiracytheories
h8zin4o,1628995170.0,iamsheik989,"I think the opposite.
If you were in power, would you want people around who pushed back? Or people who blindly complied?",p4kdb8,p4kdb8,Physical-Building-19,1,conspiracytheories
h8ziwbq,1628995306.0,Physical-Building-19,I heard that from a comedian.  Which is totally correct. But I don't think this is on purpose. But it's happening.,p4kdb8,h8zin4o,iamsheik989,2,conspiracytheories
h8zct1x,1628992129.0,DerbyWearingDude,"Do you have any facts on hand that suggest this might happen—anything beyond, ""Hey, wouldn't it be crazy if... ""?",p4kdb8,p4kdb8,Physical-Building-19,1,conspiracytheories
h8zdlyh,1628992536.0,Physical-Building-19,I guess time will tell. But most scientists are saying that the variants are being driven by the unvaccinated. So the doomsday variant would be essentially created by the unvaccinated. Not on purpose of course. I think you're just going to get angrier at me though. Which wasn't my intention but I can definitely change my intentions.,p4kdb8,h8zct1x,DerbyWearingDude,2,conspiracytheories
h8zea2t,1628992882.0,PeaceTrain33,If the vaccine was a doomsday switch - they wouldn’t advise boosters,p4kdb8,p4kdb8,Physical-Building-19,1,conspiracytheories
h8zegff,1628992972.0,Physical-Building-19,I'm not saying the vaccination is a doomsday switch. The doomsday variant would be the doomsday switch. The vaccines are doing their jobs. The unvaccinated are creating the doomsday variant.,p4kdb8,h8zea2t,PeaceTrain33,2,conspiracytheories
h8zkr8y,1628996286.0,social_meteor_2020,"Won't happen. No reason for it to happen. The vaccinated are still better protected from the variants than the unvaxxed are, despite the stories the unvaxxed are telling themselves to cope.",p4kdb8,p4kdb8,Physical-Building-19,1,conspiracytheories
h8zkyfd,1628996393.0,Physical-Building-19,You're probably right,p4kdb8,h8zkr8y,social_meteor_2020,2,conspiracytheories
h8zjcnj,1628995541.0,Vetty1205,"Everything that happens in regards to the variants and the continued spread, since the vaccine roll out, is on the shoulders of the unvaccinated now. They are the reason the world is going to shit and the virus hasn't been taken down. So I do think they will be the reason should doomsday actually occur.",p4kdb8,p4kdb8,Physical-Building-19,1,conspiracytheories
h8zk4c6,1628995946.0,Physical-Building-19,I'm inclined to agree. But blaming Columbus for the fate of the Natives doesn't do much for the Natives.,p4kdb8,h8zjcnj,Vetty1205,2,conspiracytheories
h8zlbp2,1628996590.0,Davebaker610,I don’t mean to offend this sub at all. But the fact that I’m seeing more logic and science based fact in r/conspiracytheories than in any conservative sub Reddit just speaks fucking volumes.,p4kdb8,h8zjcnj,Vetty1205,2,conspiracytheories
h8zbaj4,1628991364.0,LittleGreenBaggy,I always believed the people that have been getting FLU shots every year wouldn't have the natural immunity to fight off a super bug... and here we are with COVID.    Dr. Oz said something about the FLU shot and COVID connection on a radio talk show and was immediately cut off... so he was on to something.  When no one is allowed to speak about any other treatments other than a experimental drugs to be used for this scam it screams foul.   When doctors and scientists are not allowed to question and brain storm this is the bigger issue and raises more questions and suspicions.,p4kdb8,p4kdb8,Physical-Building-19,1,conspiracytheories
h8zd3up,1628992280.0,DerbyWearingDude,">*Dr. Oz said something about the FLU shot and COVID connection on a radio talk show and was immediately cut off...*

Based on what I've heard about Mehmet Oz, he was likely cut off to avoid letting him say some kind of damnfool nonsense that might get the station sued.",p4kdb8,h8zbaj4,LittleGreenBaggy,2,conspiracytheories
h8zbn93,1628991540.0,Physical-Building-19,It's all weird. I wish there was an illuminati controlling everything. But it's so sloppy. No one knows what the fuck is going on.,p4kdb8,h8zbaj4,LittleGreenBaggy,2,conspiracytheories
h8zqplo,1628999620.0,,[removed],p4kdb8,p4kdb8,Physical-Building-19,1,conspiracytheories
h8zw8hj,1629002981.0,DrMSL,"But that link is for a Chinese vaccine. Do Pfizer, Moderna, J&J and AZ have graphene?",p4kdb8,h8zqplo,,2,conspiracytheories
h901fv2,1629006493.0,CleverJokeOrSomeShit,Currently the vaccinated are 25 times less likely to need to be hospitalized with the Delta Variant. Covid is going to go the way of the Spanish Flu in a few years tops,p4kdb8,p4kdb8,Physical-Building-19,1,conspiracytheories
h8zegdi,1628992971.0,alanwatts112380,*eradicated,p4kdb8,p4kdb8,Physical-Building-19,1,conspiracytheories
h8zeq3m,1628993110.0,Physical-Building-19,Maybe I meant the other one.,p4kdb8,h8zegdi,alanwatts112380,2,conspiracytheories
h91jaga,1629042453.0,ConspiracyMeow,"My brother was a physics major who studied nano tech, he says it's the future of medicine.  I just don't see how it wouldn't set off someone's immune system like crazy. Look at all those people who got plastic surgery implants that they had to have removed.",p4jqta,p4jqta,fab_bulous4,1,conspiracytheories
h98alll,1629161012.0,hellhorn,"There are many different materials that the body has no reactions to. Think of all of the stents that people have, pace makers, surgically implanted rods, etc. there is a whole field of science related to making new implantable materials for medical purposes.",p4jqta,h91jaga,ConspiracyMeow,2,conspiracytheories
h8z6bd2,1628988863.0,truelies1993,"They have been trying to create a vaccine for Coronavirus since the early 2000’s, not for Covid-19…

That’s not anything new, have you done any research on mRNA?

https://scholar.google.ca/scholar?q=mrna+research&hl=en&as_sdt=0&as_vis=1&oi=scholart

https://scholar.google.ca/scholar?hl=en&as_sdt=0%2C5&as_vis=1&q=coronavirus+vaccine&btnG=#d=gs_qabs&u=%23p%3DUvYYZKpDedwJ

https://scholar.google.ca/scholar?start=10&q=coronavirus+vaccine&hl=en&as_sdt=0,5&as_vis=1#d=gs_qabs&u=%23p%3D2hME24xbF6AJ

https://scholar.google.ca/scholar?start=10&q=coronavirus+vaccine&hl=en&as_sdt=0,5&as_vis=1#d=gs_qabs&u=%23p%3D_VqWS8ZnTmoJ",p4jljd,p4jljd,fab_bulous4,1,conspiracytheories
