ID,Date_utc,Author,Body,Submission,Parent_ID,Parent_Author,Level,Subreddit
hb5fo8i,1630471422.0,Serious_News_8384,"This is an interesting idea, I could absolutely see that from McConnell, purge all the trumpers from the party so we can go back to business as usual. Use fear against the shot propaganda to keep them vulnerable, cold blooded but effective",pfigr1,pfigr1,dirtytrashwater,1,conspiracytheories
hb7m6x8,1630517214.0,dirtytrashwater,"They don’t need to purge them all, just enough to win the primaries with an establishment candidate",pfigr1,hb5fo8i,Serious_News_8384,2,conspiracytheories
hb4nimz,1630457261.0,,[removed],pfigr1,pfigr1,dirtytrashwater,1,conspiracytheories
hb583tx,1630467109.0,dirtytrashwater,"They are now that all the radicals have left and are watching alternative media telling them not to get vaccinated.

But even those radicals still trust tucker Carlson, and he’s still “understanding” of those who choose not to get vaccinated.",pfigr1,hb4nimz,,2,conspiracytheories
hb4no8v,1630457335.0,ttysnoop,The radicals don't watch or trust Fox News.,pfigr1,pfigr1,dirtytrashwater,1,conspiracytheories
hb57ki1,1630466823.0,dirtytrashwater,Not anymore but they used to.,pfigr1,hb4no8v,ttysnoop,2,conspiracytheories
hcw4uvv,1631666796.0,Wildstyle27,"Are you absolutely fucking insane? Have you not seen what the damn dictator Biden has been doing??? I mean seriously you don't need to like Fox news or trump but Trump never effected my family's livelihood or tried to take away my husband's job. He actually did very little considering. Fox is easily a pawn minus a couple people on there, but so is every there corrupt news station.",pfigr1,pfigr1,dirtytrashwater,1,conspiracytheories
hdbteyv,1631970691.0,dirtytrashwater,"Let me ask you, are you or your family vaccinated?",pfigr1,hcw4uvv,Wildstyle27,2,conspiracytheories
hb4vy0s,1630461111.0,,[deleted],pfigr1,pfigr1,dirtytrashwater,1,conspiracytheories
hb58rlq,1630467458.0,dirtytrashwater,"This is generally true, but Fox News is Murdock’s personal propaganda machine, and is generally used for political control. It’s just a lucky byproduct that it’s absurdly profitable.",pfigr1,hb4vy0s,,2,conspiracytheories
hb6iub9,1630500430.0,Santafe2008,Keeping on going Fox.,pfigr1,pfigr1,dirtytrashwater,1,conspiracytheories
hb7mn81,1630517399.0,dirtytrashwater,Bruh,pfigr1,hb6iub9,Santafe2008,2,conspiracytheories
hb4n85y,1630457125.0,Signal-Huckleberry-3,Funny thing is the “anti vax” (quotations because of the absurdity.. I’m not an anti- escargoter because I won’t eat snails) are way fucking healthier than the lab rats. We also know how to remedy covid at home 🤷‍♀️,pfigr1,pfigr1,dirtytrashwater,1,conspiracytheories
hb58klo,1630467355.0,dirtytrashwater,"No you are aren’t, and no you don’t.

But just humor me for a second and pretend you’re wrong. If the celebrities, pundits, and politicians telling you not to get the vaccine, have got it and know it is effective and safe(hypothetically), why would they tell you not to?",pfigr1,hb4n85y,Signal-Huckleberry-3,2,conspiracytheories
hb4zkeb,1630462807.0,leeguy01,"Fox News is Hate Porn,  they spew hate to get their viewers off.  

CNN doesn't piss off it's own viewers, neither does MSNBC

Fox pisses off it's own viewers as well as anyone who tunes in to see how much hate and fake news they are spewing, 

FoKKKa news is non stop grievance.",pfigr1,pfigr1,dirtytrashwater,1,conspiracytheories
hb5tq01,1630481773.0,,I stopped reading past the word 'Trumpist'. Shows how far out to lunch this thread already is.,pfigr1,pfigr1,dirtytrashwater,1,conspiracytheories
hb6kzye,1630501514.0,DirtyBird9889,"The body of this post may as well just read:

“REEEEEEEEE!”",pfigr1,hb5tq01,,2,conspiracytheories
hb9a7n0,1630543732.0,wittor,"There is clearly a conspiracy to deny and hide from conservative people the mechanics of media and how people are profiting by catering to those people. It is a simple demography to explore in the sense that people can sell to them relatively simple and low cost products for inflated prices by associating it to a nationalistic rhetoric, like pillows and candles.",pfigr1,pfigr1,dirtytrashwater,1,conspiracytheories
hb9pswe,1630551159.0,dirtytrashwater,"Absolutely the audience is the product of fox new (and all media). This isn’t deniable, but if that profit was the only purpose of Fox News they would tailor their programming to maximize consumer advertising profits, which they do not. The other far more valuable product of Fox News is its political influence over its people. Until the radicals really began to understand the internet Fox News was the ONLY national and easily accessible conservatives media platform. They had absurd political influence. 

That was its real power and value, one that the fallout of Trump is costing them.",pfigr1,hb9a7n0,wittor,2,conspiracytheories
hb4z9gr,1630462661.0,leeguy01,Killing off you own voters who are a minority and are old and dying off is not a good plan.,pfigr1,pfigr1,dirtytrashwater,1,conspiracytheories
hb57w30,1630466994.0,dirtytrashwater,"Not if you’re only killing off the ones you can’t control.

The trump coalition probably can’t win anymore. And the possibility for a new conservative majority coalition shrinks with each new wave of voters. Better smaller more manageable party then one that splinters or can’t be controlled.",pfigr1,hb4z9gr,leeguy01,2,conspiracytheories
hb5fypu,1630471602.0,Serious_News_8384,"Depends on how ya do it, done right and you may even sway some new voters your way",pfigr1,hb4z9gr,leeguy01,2,conspiracytheories
hb6vifm,1630506271.0,Harryrob01,Just wanna make a quick point on why some people don’t trust anything the government tells the American people. 2 of the leading officials just left the FDA because of Biden pushing the booster shots without the FDA approval! Just another reason why don’t trust the government!,pfigr1,pfigr1,dirtytrashwater,1,conspiracytheories
hb9qmvj,1630551587.0,mnehorosho,Another anti Trumper 😐,pfigr1,pfigr1,dirtytrashwater,1,conspiracytheories
hbblho1,1630593978.0,dirtytrashwater,And?,pfigr1,hb9qmvj,mnehorosho,2,conspiracytheories
hb5s9x2,1630480539.0,Master-Shwing,Most republicans have no idea what qult or qanon is. Wonder where these polls were taken,pfigr1,pfigr1,dirtytrashwater,1,conspiracytheories
hb7mly1,1630517384.0,dirtytrashwater,"This was my source, I didn’t dig that deep. It could be flawed.

https://www.google.com/amp/s/www.forbes.com/sites/tommybeer/2020/09/02/majority-of-republicans-believe-the-qanon-conspiracy-theory-is-partly-or-mostly-true-survey-finds/amp/",pfigr1,hb5s9x2,Master-Shwing,2,conspiracytheories
hb1sq8w,1630413165.0,wtrpro,https://hereistheevidence.com/covid/,pf4n49,pf4n49,,1,conspiracytheories
hb3eixj,1630437710.0,wtrpro,"Hahahaha, deleting you post now??? Hahahaha",pf4n49,pf4n49,,1,conspiracytheories
hb1se7x,1630412981.0,Hank_Joseph65,I live in one such community.  It already is a bloodbath.,pf4n49,pf4n49,,1,conspiracytheories
hb13ag4,1630393643.0,,[removed],peupnm,peupnm,iyqyqrmore,1,conspiracytheories
hb00pqy,1630371415.0,,[removed],peupnm,peupnm,iyqyqrmore,1,conspiracytheories
hazw7fw,1630369301.0,,[removed],peupnm,peupnm,iyqyqrmore,1,conspiracytheories
hb119gd,1630391976.0,,[removed],peupnm,peupnm,iyqyqrmore,1,conspiracytheories
hb1cme8,1630401976.0,,[removed],peupnm,peupnm,iyqyqrmore,1,conspiracytheories
hb2h7fg,1630424061.0,,[removed],peupnm,peupnm,iyqyqrmore,1,conspiracytheories
hb364ep,1630434095.0,,[removed],peupnm,peupnm,iyqyqrmore,1,conspiracytheories
hb6em38,1630498116.0,,[removed],peupnm,peupnm,iyqyqrmore,1,conspiracytheories
havarqx,1630282767.0,ATXNYCESQ,"There’s definitely a conspiracy among government, scientists/doctors, big pharma, and the media pushing people to get the vaccine. Their sinister goal: to save lives and end the pandemic.  Bastards!",pe6qe5,pe6qe5,Electrical-Green-829,1,conspiracytheories
havcqpj,1630283741.0,Electrical-Green-829,"I don't know this whole vaccine situation just feels like it's going to end the same way south park ended the pull Kenny's Life support plug episode. Anti-Vaxxers doing good for the wrong reasons (in the public's eyes[aka everyone who sided with Cartman that episode]) and Pro-Vaxxers doing the absolute worse thing for the right reasons (in the public's eyes[aka everyone who sided with Kyle that episode]). In the end the choice won't matter, just a flip of a coin that's completely blank (Just like the ending of that episode).",pe6qe5,havarqx,ATXNYCESQ,2,conspiracytheories
hawpzwv,1630314730.0,StyleAdventurous1531,https://www.harvardmagazine.com/2011/01/virus-sized-transistors,pe6qe5,havarqx,ATXNYCESQ,2,conspiracytheories
hawb6vl,1630302449.0,Odd-Dance6000,I know right,pe6qe5,havarqx,ATXNYCESQ,2,conspiracytheories
haveo2q,1630284670.0,WokeupFromsleep,"Tell you what. Don't get your information from any media source. Go read the research journals and studies by universities on the subject and base your stance on that. Stop getting your ""facts"" from Facebook. Stop getting your ""facts"" from reddit. Stop looking for easy answers. You want a agenda free insight into covid? It'll be a slog through a scientific journal full of words you'll have to Google bit hey... maybe you'll stop putting out disinformation after that.",pe6qe5,pe6qe5,Electrical-Green-829,1,conspiracytheories
havgm0a,1630285605.0,Electrical-Green-829,"Most of the ""facts"" I'm getting are from pro-vaxxers  and get disproven by science. Pro-vaxxers are essentially yelling at me to ""take it and stop being an idiot"" or post sarcastic back-handed comments that mock anyone that even has a remotely sensible question.",pe6qe5,haveo2q,WokeupFromsleep,2,conspiracytheories
hawe2mc,1630304620.0,TheAlternateEye,"I've been reading one of these papers you're talking about. It's from early 2019 and is about MRNA vaccines and why they were not ready for use yet. It talks about the successes made since the research started and the progress that needs to be made before they could go forward with the next steps in testing. It's been SUPER informative. I'm about to get to the part where they talk about how many years each of these steps will need for research in their estimation. It also talks about the dangers MRNA vaccines pose at this point in time and why they cant be used on humans.

I'm excited to finish reading this paper. I look forward to knowing as much as I can about what they thought about MRNA vaccines less than a year before covid popped up.

Spoiler: they have already said in this paper that they expect it will still be years before this type of vaccine will be safe for humans.",pe6qe5,haveo2q,WokeupFromsleep,2,conspiracytheories
havcirs,1630283633.0,finishinsideher,"I’m just at the point where I haven’t trusted news or government for a long time. They’re never straight forward and everything they do or say has an agenda or narrative behind it. It’s all trying to scare us and divide us more and more. It’s creating this separation ideology where if you don’t believe in what I believe in you’re different and a threat. “You’re killing people by not wearing a mask.” “You won’t get vaccinated, so you’re the reason this pandemic won’t end.” These are all the people who wear the homemade masks that the cdc specifically says on their page is not effective. Where I work people leave their mask everywhere on the ground and then I gotta go clean them up. How is that helping stop the spread? It’s proven that the vaccine doesn’t completely work and can still transfer and receive COVID-19. There’s countless people who have had side effects from the vaccine, but most are too scared to speak out because of the backlash the comes from anything anti about the vaccine wether you’re pro vaccine or not. It’s all another control and distract. It makes so much money because people won’t shut up about it, so they’re gonna keep pushing it.  There’s so many worse issues going on here and all over the world. But let’s stop everything we’re doing because people are getting sick. Something that we’ve dealt with since humans first existed. If we could just realize we don’t need people to make decisions for us and control our life’s and we can do things and think for ourselves, this place would be a lot more easier to sift through the bullshit. But until then let’s all tune into the news and listen to old men on how life should be lived. What’s right and wrong and no need to think for yourself because the big man already did it for you. [I’m just a nobody, but this video helps explain and convey what I’m trying to get across. ](https://youtu.be/09maaUaRT4M)",pe6qe5,pe6qe5,Electrical-Green-829,1,conspiracytheories
havev32,1630284762.0,TaylorPRocker,"I’m glad you feel safe posting these things. I posted this on an opiates forum and you wouldn’t believe the backlash. I’m a recovering addict and on this forum, try to spread my knowledge of safety and things I’ve got experience with. 

You would think though, with a pharmaceutical company literally paying out hundreds of millions as we speak because they promoted and distributed a miracle drug capable of combating chronic pain, nearly addiction free and abuse-proof all while making sure to target impoverished areas with high unemployment, low opportunity, labor intense communities with high injuries.....   we now know they were lying the whole time just so they could make billions off the drugs that are now synonymous with corporate greed (OxyContin and MsContin, I know the devastation seeing as I’m a resident of West Virginia). 

Bottom line is, I don’t trust these people. I believe it’s Pfizer that raked in 6billiin, with a B only in the last QUARTER!!!  That’s insane. And when you learn there’s a 99.98% survival rate, no repercussions or payouts if this thing goes south. Also taking into account, the industry was able to lobby through Congress User Fees in the early 90s basically basically passing drugs only to the highest bidder. And lastly, consider that fact the every company has a completely different vaccine, different formula, different patent and the government says, “it doesn’t matter that they don’t really work, don’t care which one, just take one of them” tells me this has nothing to do with public safety (otherwise insulin, antibiotics, and epipens would be free and available at your local pharmacy where they’d pay YOU to take them) and all it has to do with is control, comply, assimilate and divide. 

Thanks for your time. Please don’t reply if you don’t agree. I won’t reply. You won’t change my mind and I obviously won’t change yours but rest assured my opinion does change and in time, I will be more inclined to take this thing as more studies are published",pe6qe5,havcirs,finishinsideher,2,conspiracytheories
hax5ca4,1630325999.0,KO239,I watch that channel regularly .. good choice.,pe6qe5,havcirs,finishinsideher,2,conspiracytheories
have0ai,1630284352.0,Electrical-Green-829,"I understood you clear as day, the video on mass psychosis was very informative as well.",pe6qe5,havcirs,finishinsideher,2,conspiracytheories
haxdjo3,1630330337.0,,"People smoke,drinks,eat stuff that we don’t know what’s in it, do drugs that we don’t where they came from and most likely is killing a lot of people and we have no complaints about it all this anti vax argument sounds like a cry of help or a bitch move to have some sense of control which we don’t have even if we think we do just grow the fuck up and take it like a good girl does.",pe6qe5,pe6qe5,Electrical-Green-829,1,conspiracytheories
hav9yhv,1630282363.0,HbRipper,I think they are pushing for vaccination to reduce the pandemic,pe6qe5,pe6qe5,Electrical-Green-829,1,conspiracytheories
havdcpb,1630284039.0,-_somebody_-,What strange logic,pe6qe5,hav9yhv,HbRipper,2,conspiracytheories
havue4j,1630292446.0,fierce1hander,Great. How's that working out for Israel?,pe6qe5,hav9yhv,HbRipper,2,conspiracytheories
hawpx20,1630314660.0,StyleAdventurous1531,"I just don’t trust the NWO. Why this has come as a surprise or shock to people baffles me. We have been told for years that there would come a time when we would be all branded and controlled.

It’s scary going down that rabbit hole, easier just to stop being critical and trying to discuss things in a rational manner when you are just battered into submitting to the mantra that this is good for us!
That you can’t question why.

That you won’t be allowed to travel

You won’t be allowed to get a job

That you will be ostracised, victimised and treated like pariah for just saying … I’m not sure, can we not rush this?

Charles Lieber.

https://www.justice.gov/opa/pr/harvard-university-professor-and-two-chinese-nationals-charged-three-separate-china-related

What is his speciality?

https://www.harvardmagazine.com/2011/01/virus-sized-transistors

This information and more is readily available online but for whatever reason being kept quiet.

An American scientist working at Wuhan university , who specialised in nanotransmitters being injected into people was arrested by the FBI just after the outbreak of Covid-19.., fact! 

Happy to be proven wrong",pe6qe5,pe6qe5,Electrical-Green-829,1,conspiracytheories
hax88kl,1630327632.0,diddy512,"I don't have the vaccine. I still haven't made that decision, maybe you can help me. I need scientific proven facts, that the vaccine is not safe. I neither believe the media nor the dubious sites from the guys sitting in some basement.
Can anybody give some credible, scientific source that vaccines are not safe? I want to prove that my intuition in not getting it is right on this.",pe6qe5,pe6qe5,Electrical-Green-829,1,conspiracytheories
haxehlt,1630330793.0,Electrical-Green-829,"That's what I would like to know too, of all places Wikipedia seems to have the most reliable sources of information about it.",pe6qe5,hax88kl,diddy512,2,conspiracytheories
hb9hp8f,1630547174.0,Electrical-Green-829,Wow a mod changed my flair from discussion to Antivaxxx bullshit. I'm just asking questions and trying to engage in constructive conversation. How is that antivax?,pe6qe5,pe6qe5,Electrical-Green-829,1,conspiracytheories
hatgj9y,1630253718.0,wittor,Lord forbid you from asking who produces the ivermectin people are taking. The guys on Brasil had a 8 fold growing in their profits in 2020 and we are still the third country with more deaths.,pdp78x,pdp78x,Capt_Trout,1,conspiracytheories
haurdac,1630273611.0,Capt_Trout,My thoughts exactly,pdp78x,hatgj9y,wittor,2,conspiracytheories
hasp12q,1630241012.0,barefootshoesalesman,"How, in your mind, would a virus ""mix"" with a protein deformity, or a fungus?",pdlv7f,pdlv7f,,1,conspiracytheories
hatgsx7,1630253828.0,ecobrennan,Lol exactly that’s not how viruses work.. Two completely different viruses mixing to form a supervirus sounds like a great movie tho if it already isn’t one,pdlv7f,hasp12q,barefootshoesalesman,2,conspiracytheories
hard1sp,1630205562.0,vexunumgods,This is interesting https://science.sciencemag.org/content/covid-19-and-mad-cow-disease-so-different-yet-so-similar,pdlv7f,pdlv7f,,1,conspiracytheories
hasaf1b,1630229736.0,jenovakitty,half of the website is cut off?,pdlv7f,hard1sp,vexunumgods,2,conspiracytheories
hawzush,1630322523.0,CapnBloodbeard,Ok. Wrong sub?,pdlv7f,pdlv7f,,1,conspiracytheories
hb020oe,1630372024.0,jenovakitty,my theory about it is in the post.,pdlv7f,hawzush,CapnBloodbeard,2,conspiracytheories
haq5ujo,1630184014.0,SixIsNotANumber,"Locking post.  
This is not the place to complain about bans from other subs.",pdhfan,pdhfan,homebrewedstuff,1,conspiracytheories
haq3z9j,1630183175.0,SphumbuPonToast,Synchronized periods.,pdhfan,pdhfan,homebrewedstuff,1,conspiracytheories
haq5n2q,1630183920.0,AllisStar,"I wouldn't worry about it, the fact that he called you a pez dispenser shows how little he knows about the health care profession. Seems like you are right pre-emptive ban because you support vaccination efforts. Interestingly I saw a supposed conversation today where a pharma assitant says they are instructed to refuse to fill out perscriptions for that dewormer if its for covid. I doubt it is real since when you get a perscription the pharma doesn't know what its for, they call only deduce the general type of ailment unless its a specific drug for 1 thing. So anyways maybe he thinks you are part of the problem",pdhfan,pdhfan,homebrewedstuff,1,conspiracytheories
hawwry8,1630320297.0,Swallowtail13,My mate died of blood clots from AZ vaccine ...that's my worry ..you have to be unlucky.,pdgzxz,pdgzxz,g0dzilla9121,1,conspiracytheories
hasmefw,1630239372.0,Hyphylife,Lmao,pdgzxz,pdgzxz,g0dzilla9121,1,conspiracytheories
hawjuo7,1630309357.0,Londonsky112596,"I’m not anti-vaccine. I’m not a Republican. I’m not a Democrat. I’m not a sheep nor a wolf. The virus is real. It has killed many. I’ve had it with mild symptoms but my mother, brother and friend suffered from it. From the Polio vaccine to the Flu vaccine. They have saved millions of lives. Yet, this isn’t your typical yearly ‘back to school’ shot. The FDA prematurely slaps an approval on it Monday solely because of public pressure. This is the first vaccine distributed to billions of people made with a MRNA technology; it acquired FDA approval in less than four months, one of their fastest approvals compared to other common vaccines. You won’t be able to attend a university, travel by air or ship, risk of being fired by your job, attend a concert or festival without a Covi-Pass/immunity passport by 2023, dozens of articles have been published by reputable sources explaining. This is long term, society altering technology. Laws that will be widely and sternly enforced for every living individual who wish to be apart of society. Is it silly of me to be a bit skeptical?",pdgzxz,pdgzxz,g0dzilla9121,1,conspiracytheories
hasi4zt,1630236363.0,TheBemusedPanda,Well this is a bit of a shitpost.,pdgzxz,pdgzxz,g0dzilla9121,1,conspiracytheories
hat0w68,1630247020.0,,[deleted],pdgzxz,pdgzxz,g0dzilla9121,1,conspiracytheories
hau036i,1630261803.0,g0dzilla9121,"I mean yeah y’all are stupid as fuck that’s why I’m in here, to see some crazy shit that makes me laugh not a bunch of 5 year olds with 2 brain cells complain every day",pdgzxz,hat0w68,,2,conspiracytheories
hasii07,1630236642.0,slipknot_official,"Welcome to the past 8 months in every conspiracy sub.

I'll never understand why people are so afraid of something they won't get in the first place.",pdgzxz,pdgzxz,g0dzilla9121,1,conspiracytheories
hb92hps,1630540108.0,Valkyria1968,"Because the government is trying to MAKE
US get it, that's why.",pdgzxz,hasii07,slipknot_official,2,conspiracytheories
hau3hnj,1630263255.0,AnywhereButHere404,same. just trying to find interesting shit to read and instead it’s just morons complaining,pdgzxz,pdgzxz,g0dzilla9121,1,conspiracytheories
hasmgxb,1630239417.0,HbRipper,"Well said, I left the some other conspiracy sub because of this. So annoying",pdgzxz,pdgzxz,g0dzilla9121,1,conspiracytheories
hasq1od,1630241597.0,Old_Man_Shogoth,That is the conspiracy bro.  *They* are trying to discredit the entire conspiracy community by painting us all with the brush of antivaxxers.  Anyone pushing antivax propaganda is a shill for *Them* and is not to be trusted.,pdgzxz,pdgzxz,g0dzilla9121,1,conspiracytheories
hasir3a,1630236833.0,PC707,"Only one side is about to lose everything for this. 

Go back to r/JustCuckThings where you belong.

Btw, extraterrestrials are a scam too.  Check out Mac Tonnies.",pdgzxz,pdgzxz,g0dzilla9121,1,conspiracytheories
haszwqa,1630246577.0,TokyoDrip_,Shut the fuck up,pdgzxz,hasir3a,PC707,2,conspiracytheories
hd9uhcf,1631924048.0,DildoShwa66ins,"I’m not anti-vaccine but there are far sinister agendas behind this one! 

COVID-1984 Unvaccinated here and intend to keep it that way 👊",pdgzxz,pdgzxz,g0dzilla9121,1,conspiracytheories
hamkvxx,1630111325.0,WingJeezy,"We were long overdue for a pandemic, and the fact that multiple generations grew lax in the post vaccine era as we steadily eradicated diseases left us complacent and ill prepared for the next inevitable pandemic.",pcz5b1,pcz5b1,cookieeeeeeeeeee33,1,conspiracytheories
hamh923,1630109548.0,slipknot_official,"I'm curious why it's such a popular thing to believe that EVERYTHING is controlled and designed. That reality is just controlled by a few fat rich people, and nothing natural every happens.

Look at history, pandemics have happened over, and over again. We are humans subject to a chaotic world where nature is trying to kill us around every corner. I feel people have a hard time accepting that humans are powerless abasing nature, so they subscribe to the belief that events are planned out and natural occurrences rarely happen.

So, my answer is; it just happened. It's just the result of a chaotic universe playing itself out.

Now can humans use events for agendas? Sure. Again, historically that has always has been the case.",pcz5b1,pcz5b1,cookieeeeeeeeeee33,1,conspiracytheories
hamndty,1630112579.0,Spaghettimajor,I like hearing multiple theories...as none of us really know the truth. There are a lot of plausible possibilities.,pcz5b1,hamh923,slipknot_official,2,conspiracytheories
hami0mp,1630109922.0,cookieeeeeeeeeee33,"Ur on a cospiracy theories subreddit what do u expect to see, is in our nature to overthink things, i dont necessary believe in the thing that i posted i just want to hear different opinions but only things that i heard till now is shit, only people that cant understand what im trying to or very ""in my own bubble"" type of people",pcz5b1,hamh923,slipknot_official,2,conspiracytheories
