ID,Date_utc,Author,Body,Submission,Parent_ID,Parent_Author,Level,Subreddit
h9oh5uh,1629476907.0,sakchaser666,Lol you triggered some folks with this one,p871gc,p871gc,,1,conspiracytheories
h9oiy6w,1629477619.0,Admirable-Leave9783,Because you’re immune system has developed through 3.5 billion years of fighting viruses,p871gc,p871gc,,1,conspiracytheories
h9oegzd,1629475834.0,Andre_Type_0-,"This isn't a conspiracy, i think you'd be better off posting somewhere like r/imanidiot",p871gc,p871gc,,1,conspiracytheories
h9ocm9g,1629475089.0,usernamesaretits,This is the problem. People do not agree on the death count. People do not agree on the adverse effects from the vaccines. It doesn't take a rocket scientist to figure out why people cone to different conclusions.,p871gc,p871gc,,1,conspiracytheories
h9ob6mb,1629474518.0,StrongLikeBull3,"The mortality rate of the vaccine is 0.002%.

The mortality rate of covid in the US is 1.7%. 

You can’t say that the vaccine one is a significant percentage and the covid one isn’t.",p871gc,p871gc,,1,conspiracytheories
h9okn7d,1629478293.0,michbobcat75,"Love how statistics can be used to pit people against each other. Its all a part of the game they want you to play for control. 

All of these numbers are fabricated. 

Deaths were counted as COVID deaths all along whether they were due to COVID or not...the numbers are skewed for greater fear of COVID. 

VAERS is voluntary reporting...so in the case of deaths...only the ones following the rules are reporting, so the number is likely much higher. Skewed to lessen fear of the vaccine. 

The fact is, the vaccine is much more dangerous than they are letting on, the effects are being censored, while the numbers of COVID are much lower, but we won't ever know the true numbers. 

The numbers are whatever they need to be for the desired effect.",p871gc,h9ob6mb,StrongLikeBull3,2,conspiracytheories
h9oboc1,1629474712.0,jadamcyk,Yes but i think most people avoid the jab since 1.7% is a ridiculously low risk %. And most of the people getting sick are at risk populations.,p871gc,h9ob6mb,StrongLikeBull3,2,conspiracytheories
h9ofd26,1629476193.0,fuckyouatmaildotcom,">mortality rate of covid in the US is 1.7%. 

Of old,  ill  people, maybe. People susceptible from dying of respiratory viruses,  pneumonia,  etc.

 Check qcovid.org/calculation for a risk calculator from uni of Oxford - my chance is 0.001% - ie *the vaccine is twice as deadly* for me.",p871gc,h9ob6mb,StrongLikeBull3,2,conspiracytheories
h9o7t2y,1629473160.0,Efficient_Attitude96,Logic was not part of the master plan.,p871gc,p871gc,,1,conspiracytheories
h9obq0p,1629474730.0,avataraustin,"The original argument was we needed herd immunity to stop the spread. Then it was revealed that those who got the jab were still getting sick and still transmitting, the benefit then got touted as making the sickness less severe then it otherwise would have been. 
Anyone who can connect two dots can see that this was never actually about protecting people.",p871gc,p871gc,,1,conspiracytheories
h9o4xac,1629471986.0,tehbearded1der,So much confusion.,p871gc,p871gc,,1,conspiracytheories
h9oap1g,1629474322.0,slipknot_official,Almost 5 BILLION people globally,p871gc,p871gc,,1,conspiracytheories
h9ok5ve,1629478101.0,GeekRemedy,What did they do?,p871gc,h9oap1g,slipknot_official,2,conspiracytheories
h9oi7fq,1629477321.0,ProtectionAdvanced,"Looks like someone read ""How to Lie with Statistics"".",p871gc,p871gc,,1,conspiracytheories
h9oboc4,1629474712.0,jts222,Get Twitter screen shots out of here wtf. There is an entire other sub for this low IQ crap.,p871gc,p871gc,,1,conspiracytheories
h9ol6b6,1629478506.0,GeekRemedy,Sorry. I’ll just type it out next time.,p871gc,h9oboc4,jts222,2,conspiracytheories
h9o5gji,1629472205.0,Questioned_answers,Alive and sterile,p871gc,p871gc,,1,conspiracytheories
h9oceeu,1629475001.0,BryceAlanThomas,r/Ibelieveeverythingthatimtold,p871gc,p871gc,,1,conspiracytheories
h9ofxr0,1629476419.0,senjusan11,"Viruses and bacteria are one thing, chemical compounds injected straight into your body that bypasses or natural protection layers is completely different thing. 

It's like saying that your immune system should easily get rid off heroine that you injected into your blood stream. 

Seriously who is stupid enough to even think about posting shit like this? Read some books, educate yourself and until then please shut up",p871gc,p871gc,,1,conspiracytheories
h9ofswh,1629476367.0,dadventuretime,"Is this serious? Why do libtards always have this level of pisspoor logical ability?

The guy can’t differentiate between fighting off a virus and the body’s short or long-term reaction to a piece of experimental technology?",p871gc,p871gc,,1,conspiracytheories
h9oh8h0,1629476935.0,RUSTYSCALPEL15,Your lack of education is the cause for your confusion.,p871gc,p871gc,,1,conspiracytheories
h9ob4be,1629474492.0,xfallensheep,That’s completely makes sense.  I’m full of antivaxxers and all this conspiracy bullshit. Just take the damn shot…,p871gc,p871gc,,1,conspiracytheories
h9obhe7,1629474635.0,jadamcyk,Nah I’m good,p871gc,h9ob4be,xfallensheep,2,conspiracytheories
h9oawhu,1629474405.0,BullFr0GG,....so far,p871gc,p871gc,,1,conspiracytheories
h9ofx1z,1629476412.0,adventuresofjt,Survived… so far…,p871gc,p871gc,,1,conspiracytheories
h9ogcbd,1629476579.0,OpenMindedShithead,This is a good point but definitely not a conspiracy theory,p871gc,p871gc,,1,conspiracytheories
h9oiqvb,1629477538.0,Uresanme,Did you learn about this in medical school?,p871gc,p871gc,,1,conspiracytheories
h9on6vz,1629479313.0,Glad-Candidate1155,Im still reading it......i got nothing,p871gc,p871gc,,1,conspiracytheories
h9ojek3,1629477798.0,DigTheScene1,"If it ain't broken, then why fix it?",p871gc,p871gc,,1,conspiracytheories
h9nqb33,1629465728.0,reevoknows,"I can wrap my head around basically everything you said until you started talking about tracking devices in the vaccine. Maybe the virus was manufactured and maybe the vaccine is a placebo but I don’t believe there’s anything wrong with the vaccine that will kill us or us tracking us or anything like that. I’m more inclined to believe the virus was nothing to worry about and the politicians are in bed with vaccine manufacturers. 

I’m as cynical as they come which is why I’m in this sub but sometimes the explanation just as simple as the rich wanting to be richer.",p848ke,p848ke,Soul-save4u2,1,conspiracytheories
h9nro30,1629466369.0,poppingtabs,"Honestly I wish somebody could convince me to get the vaccine. I really do. I'm no anti vaxxer I have been vaxxed for all the usual and so is my family, but this shit is just different. Before all this vax crap my entire family had covid and it was a breeze. No problems at all other then a few trips to the toilet and listening to my wife complain she couldn't taste her food but that it. It was gone in 3 days tops. Then it all started with bribes. Why are you bribing me to basically get a flu shot? Ok no big deal I'll pass. Now it's you have to take it and show proof to go places or even work in some places. Those are big red flags to me. All these people getting the shot and end up sick a few weeks later. They act like it will go away, but if its circulating in the population and continuously mutating and also spreading with animals it will never go away. I just dont get it, I really dont. Hell the flu kills atleast 60k every year and I haven't had a flu shot in over 25 years. I'm at the point where if you did get the shot. Keep your ass away from me, Idk anymore!",p848ke,p848ke,Soul-save4u2,1,conspiracytheories
hd2kz78,1631795821.0,onfroiGamer,"Just don’t get it if you don’t want to, no one is putting a gun against your head to get vaxxed, those places that ask for proof of vaccine should also accept a negative test result.",p848ke,h9nro30,poppingtabs,2,conspiracytheories
h9nlbxf,1629463274.0,NefariousnessOne1859,"My main question about this is….with so many people on the world,,,,where or how are they storing the data? Surely it’s got to be a gigantic amount of data if they are monitoring everyone over such a prolonged period of time. How will the workers have time to survey all the data? What is the purpose of them collecting the data? 

Would be interested to know more on this aspect.",p848ke,p848ke,Soul-save4u2,1,conspiracytheories
h9nrjex,1629466310.0,ApokatastasisComes,https://www.krannert.purdue.edu/academics/mis/workshop/AC2_100606.pdf,p848ke,h9nlbxf,NefariousnessOne1859,2,conspiracytheories
h9nre3y,1629466241.0,RealWalterMercado,PLTR,p848ke,h9nlbxf,NefariousnessOne1859,2,conspiracytheories
h9non14,1629464931.0,bnb2407,"I like how your source for ""This lead me straight to the CDC WEBSITE.. which gave me the surveillance and monitoring program"" is a reddit post with 0 upvotes",p848ke,p848ke,Soul-save4u2,1,conspiracytheories
h9npsvn,1629465490.0,manicfaceisreal,My dude… the surveillance device you’re talking about is found in your pocket. Not in a vaccine.,p848ke,p848ke,Soul-save4u2,1,conspiracytheories
h9nqhi2,1629465815.0,mremann1969,"I believe this is ultimately about depopulation. The elites want much fewer of us ""useless eaters"" consuming ""their"" natural resources.

I believe by 2025, we will have lost 10 million Canadians. 

America will essentially fall by 2025, as the population will drop by about 220 million souls. 

Vaccines will be the chief driver of this, thanks to their ""side effects"".",p848ke,p848ke,Soul-save4u2,1,conspiracytheories
h9nma95,1629463759.0,FuxationSensation,😂,p848ke,p848ke,Soul-save4u2,1,conspiracytheories
h9nmavo,1629463768.0,3006mv,Less flu because masking and better sanitary practices washing hands and social distancing. Source for numbers re : numbers of people affected?,p848ke,p848ke,Soul-save4u2,1,conspiracytheories
h9nn0gg,1629464123.0,CozyCoffeeMan,"Guys, you cannot be serious",p848ke,p848ke,Soul-save4u2,1,conspiracytheories
h9nkx1p,1629463058.0,KO239,Sounds right.,p848ke,p848ke,Soul-save4u2,1,conspiracytheories
h9nmj7w,1629463883.0,ledfox,"What you created an account an hour ago to try to get people killed?

Go away, psyop.",p848ke,p848ke,Soul-save4u2,1,conspiracytheories
h9nn2g1,1629464151.0,Yashabird,"These aren’t exactly caveats, and i personally don’t give a shit who gets a covid vaccine, but some thoughts that i had during the pandemic were that communicable disease is just unavoidably the best physical manifestation of the interdependence between all humans. “Don’t tread on me” is a very fair political position to take, but it gets harder and harder the more people there are living literally/physically on top of other people. If you have money or power you can still keep the barbarians at bay, even if you live in a megalopolis, but social coordination is the only way to survive a new plague *without toppling society* (so social coordination over covid is less about a reset and way more about maintaining the status quo, which is theoretically just as sinister). 

Maybe covid was manufactured to accelerate this, but eventually it is bound to happen that something natural will achieve the same thing, at which point, won’t the powerful try to continue the status quo? 

An interesting thought experiment is…imagine that they *weren’t* pushing the vaccine on people…? Or just imagine a much deadlier virus, and they had a vaccine for it which totally worked, and every major media outlet was spreading fear of the vaccine over fear of the virus… That sounds like a way more sinister way to kill off the undesirables and amass power for an elite.",p848ke,p848ke,Soul-save4u2,1,conspiracytheories
h9nnipa,1629464375.0,,[deleted],p848ke,p848ke,Soul-save4u2,1,conspiracytheories
h9ns7f1,1629466614.0,tahitianisland1409,"Business.

I'm fully vaccinated, medical doctors, researchers, among other experts worldwide have studied and confirmed that vax can help. I know someone who was completely vaccinated but still got the virus. He's on his sixties and with underlying health conditions. You still can't be too complacent even when you got vaxxed.

Some gained so much from this pandemic, financially speaking. And I'm here, hoping the innocent ones aren't the sacrificial lambs and that there's still decency in these people who have the capability to change the course of human civilization.",p848ke,h9nnipa,,2,conspiracytheories
h9nrbgu,1629466207.0,Bfastsausage,The flu “which somehow has been almost cured since covid came to town”. This guy sciences.,p848ke,p848ke,Soul-save4u2,1,conspiracytheories
h9nrkkz,1629466325.0,TakemetoFuNkYtown_,"Y’all nut jobs should’ve seen the contents of the polio vaccine. Each dose had a abacus in it, fuckers were huge.",p848ke,p848ke,Soul-save4u2,1,conspiracytheories
h9omujd,1629479177.0,mcplakers,“Now I’m a connect the dots kind of guy.” Yea bro you totally came up with this. You didn’t just repeat what you’ve been told by your circle.,p848ke,p848ke,Soul-save4u2,1,conspiracytheories
h9nmknr,1629463903.0,,"The infrastructure is in place.

Need more global stimulus like this fake pandemic, mass refugee migration, election fraud, perpetual war, economic crash, et cetera, to get that train rolling.

We've known this was coming for 2000 yrs. It's not here yet, but it's visible on the horizon.",p848ke,p848ke,Soul-save4u2,1,conspiracytheories
h9no3ko,1629464664.0,,Real sus how they don’t talk about India.,p848ke,p848ke,Soul-save4u2,1,conspiracytheories
h9k5ff2,1629395486.0,Thoth187,Fuck no. Y’all enjoy your 26 boosters.,p7jqqb,p7jqqb,,1,conspiracytheories
h9k5las,1629395554.0,Gaddster09,Definitely NO,p7jqqb,p7jqqb,,1,conspiracytheories
h9k5z2b,1629395711.0,Ok-Office1687,How is virtue signaling in a post a conspiracy ?,p7jqqb,p7jqqb,,1,conspiracytheories
h9k4ia0,1629395105.0,LittleGreenBaggy,Never!,p7jqqb,p7jqqb,,1,conspiracytheories
h9k6n1r,1629395990.0,Realm6Universe,"I used to be anti-vax til I realized that both radical vaxxers and anti vacxers are holding extreme views that cater to a collective fear-mongering. If you wanna get it, get it. If you don't, then don't, but on both sides be prepared for the consequences that come with that. 

I got it recently after seeing the DELTA plus variant and I've had no side effects or issues. I haven't lost my connection to the universe and I still practice high magic. Nothing has changed in my physiology. 

I don't understand why this is yet another thing to fight over. That's what's really going to make us all sick until we end ourselves.",p7jqqb,p7jqqb,,1,conspiracytheories
h9kbp0i,1629398117.0,bwceighty3,Hard pass for me.,p7jqqb,p7jqqb,,1,conspiracytheories
h9kc1r2,1629398265.0,Jet_wolf121,Definitely No,p7jqqb,p7jqqb,,1,conspiracytheories
h9k7ppd,1629396435.0,DixonSeider69,"It’s probably more based to get arrested for not getting it. So I’ll play their bullshit. 

I’ll get tested twice a week. I’ll wear their useless mask. But i will not take their drug",p7jqqb,p7jqqb,,1,conspiracytheories
h9k9rvt,1629397314.0,Goodomens23,Got both mine back in February,p7jqqb,p7jqqb,,1,conspiracytheories
h9k4u7q,1629395245.0,thatchallengerguy,"getting???

the fuck have you been waiting for",p7jqqb,p7jqqb,,1,conspiracytheories
h9k4qqa,1629395204.0,FortHero,My boss said I can’t start work without it. De Niro....my hands are tied.,p7jqqb,p7jqqb,,1,conspiracytheories
h9k6q5m,1629396025.0,MastahKenobey,"You all are crazy retards, ngl",p7jqqb,h9k4qqa,FortHero,2,conspiracytheories
h9k75wh,1629396206.0,-----anja-----,Yes of course,p7jqqb,p7jqqb,,1,conspiracytheories
h9k6584,1629395782.0,dmanty45,Wasn’t this asked already?,p7jqqb,p7jqqb,,1,conspiracytheories
h9kgdrn,1629400072.0,Redditer5241,No never,p7jqqb,p7jqqb,,1,conspiracytheories
h9kncbv,1629402915.0,parsonscrowley,"You’ll have to strap me down with a gun to my head, but I don’t expect anything less",p7jqqb,p7jqqb,,1,conspiracytheories
h9iczjy,1629361166.0,NefariousnessOne1859,"The universe is a clock. Cycles repeat. Earth is due some sort of big catastrophic event. Nothing we do will stop the effects of climate change, it’s too far gone now and it’s just part of the cycle so it was going to happen eventually….whether the end comes in our lifetime or 100 generations from now. There needs to be some big change in order to advance to the next evolutionary stage.",p7ansh,p7ansh,HenDenDoe64,1,conspiracytheories
h9iw4qg,1629375738.0,,You’re ignorant and don’t know basic shit about science,p7ansh,p7ansh,HenDenDoe64,1,conspiracytheories
h9jt6uv,1629390443.0,HenDenDoe64,Wet markets have been around longer than high carbon level climate.,p7ansh,h9iw4qg,,2,conspiracytheories
h9hdbl3,1629338077.0,Serious_News_8384,Are they not smart enough to just give him a shot of saline or something instead of this sillyness?,p74c8a,p74c8a,iimrwanz,1,conspiracytheories
h9i6jrb,1629355714.0,ZolotoGold,"Well he may already have had the vaccine, but this is for a promotional video. It could be basically just acting for a video.",p74c8a,h9hdbl3,Serious_News_8384,2,conspiracytheories
h9ic3oi,1629360395.0,Greed155,I guess the man is scared of needles,p74c8a,h9hdbl3,Serious_News_8384,2,conspiracytheories
h9htdht,1629346450.0,44324,"Already got the shot 

Didn’t want him wincing in pain on camera like most people do with a shot

Needed to multiple takes and obviously wouldn’t give him multiple shots 

Used an actor to be the doctor instead of a real doctor 

Sooo many plausible explanations",p74c8a,p74c8a,iimrwanz,1,conspiracytheories
h9iog09,1629370790.0,Nathan1506,"all of these sound reasonable.

I was thinking, even if I did intend to get the shot that day, surely its better to do a fake for the camera and not risk me wincing, bleeding, etc making it look unpleasant... the goal is to get more people to take it?",p74c8a,h9htdht,44324,2,conspiracytheories
h9iopqb,1629370987.0,spacechickens,"That was my thought. Already had the shot off camera, but needed to repeat it for the cameras without actually having a second dose. Also, most TV interviews are filmed in several takes, even supposedly “live” ones.",p74c8a,h9htdht,44324,2,conspiracytheories
h9h6czr,1629334793.0,VoiceOfReason1621,Any idea who this is?,p74c8a,p74c8a,iimrwanz,1,conspiracytheories
h9hc3xq,1629337501.0,Aeraphel,"Great question, answer, probably no one. Random film attributed a story lol",p74c8a,h9h6czr,VoiceOfReason1621,2,conspiracytheories
h9hfsls,1629339280.0,Dspsblyuth,Some Jewish guy,p74c8a,h9h6czr,VoiceOfReason1621,2,conspiracytheories
h9iy9cx,1629376910.0,SixIsNotANumber,"""An Israeli politician"" according to the headline. Shame nobody seems to know *which one*.  You wouldn't think there's that many to sort through, it's not a large country.",p74c8a,h9h6czr,VoiceOfReason1621,2,conspiracytheories
h9h7yww,1629335548.0,Titan6783,"Maybe, just maybe, now hear me out in this…he had already gotten the vaccine long before signing up to do this video.",p74c8a,p74c8a,iimrwanz,1,conspiracytheories
h9hd7pz,1629338026.0,MsJenX,That was my first thought too.,p74c8a,h9h7yww,Titan6783,2,conspiracytheories
h9hfiu8,1629339147.0,earthvox,"OR, maybe he did the fake vaccine video for the explicit reason of stirring up the controversy?",p74c8a,h9h7yww,Titan6783,2,conspiracytheories
h9i6b04,1629355516.0,HavocNightrage,This is most likely,p74c8a,h9h7yww,Titan6783,2,conspiracytheories
h9hoxb3,1629343919.0,Sloppy_Waffler,Then why lie and be disingenuous,p74c8a,h9h7yww,Titan6783,2,conspiracytheories
h9hk0wg,1629341369.0,maybedisco_boy,"No, must be a political deep state conspiracy.",p74c8a,h9h7yww,Titan6783,2,conspiracytheories
h9ltzht,1629421584.0,suckatgolfbutilikeit,"Or maybe he's an antivaxer and the doctor is his friend I love how everybody is just saying oh he definitely must've gotten it,  nobody fuckin knows,  all we know for sure is he got caught faking getting a vaccine",p74c8a,h9h7yww,Titan6783,2,conspiracytheories
h9h9iq7,1629336277.0,bzzkirk14,Hahaha. Funny,p74c8a,h9h7yww,Titan6783,2,conspiracytheories
h9h6f61,1629334820.0,JohnnyTheSlug,"""EVERYONE NEEDS TO TAKE THE VACCINE!  except me...BUT ALL YOU NORMAL PEOPLE!""",p74c8a,p74c8a,iimrwanz,1,conspiracytheories
h9hnzzy,1629343425.0,Uresanme,All medical doctors have taken the vaccine. What’s your excuse?,p74c8a,h9h6f61,JohnnyTheSlug,2,conspiracytheories
h9h6l08,1629334897.0,jaejaeok,I want this trick done on me lol,p74c8a,p74c8a,iimrwanz,1,conspiracytheories
h9hf42n,1629338945.0,earthvox,Have you seen The Rock’s vaccine video?  Similar horse shit. Thanks for sharing!,p74c8a,p74c8a,iimrwanz,1,conspiracytheories
h9hfzod,1629339376.0,Dspsblyuth,Link?,p74c8a,h9hf42n,earthvox,2,conspiracytheories
h9hv40b,1629347505.0,mark_vader,"He was probably already vaccinated, why take multiple vaccinations if you don’t have to",p74c8a,p74c8a,iimrwanz,1,conspiracytheories
h9hg4v0,1629339447.0,BojukaBob,Not nearly as often as grifters secretly getting vaccinated while publicly pretending to be antivax because some people are just that gullible.,p74c8a,p74c8a,iimrwanz,1,conspiracytheories
h9hhqku,1629340236.0,Nicks_WRX,What would someone have to gain by doing that?,p74c8a,h9hg4v0,BojukaBob,2,conspiracytheories
h9iosys,1629371050.0,secondspawn85,"Lots of comments saying ""Many many reasons to set up a photo op like this"", some of them make good points, that are not easy to counter. 
What I would like to know though, is after months of similar videos seeing people pretend to receive an injection, why are they still fucking up these photo ops and giving the ""anti vax conspiracy theorists"" more ammunition? If my intention was to show myself receiving a vaccine to reassure people I would sure as hell make sure I was injected. All rather fishy to me. More division maybe?",p74c8a,p74c8a,iimrwanz,1,conspiracytheories
h9halxx,1629336796.0,usernamesaretits,And its shit like this that makes me more and more conspiratorial,p74c8a,p74c8a,iimrwanz,1,conspiracytheories
h9hhr5i,1629340244.0,iimrwanz,"You're right. That's why I tend to use the term ""truther"" instead of the tainted ""conspiracy theorist""",p74c8a,h9halxx,usernamesaretits,2,conspiracytheories
h9hrhei,1629345352.0,Unlost_maniac,"I'm pretty sure the vaccine is against their religion or something. Could even be an allergy and or disorder

Usually all this stuff has such simple explanations",p74c8a,h9halxx,usernamesaretits,2,conspiracytheories
h9hs8bj,1629345781.0,OpenMindTulsaBill,"How do you ""secretly"" film from above with a handheld camera (evidenced by the camera moving sporadically)? Just wondering.",p74c8a,p74c8a,iimrwanz,1,conspiracytheories
h9hf6ke,1629338980.0,puck411,Look up Anthony Hopkins covid vaccine shot on youtube. He doesn't get it,p74c8a,p74c8a,iimrwanz,1,conspiracytheories
h9hi3xx,1629340417.0,iimrwanz,"Damn, that's insane. More outrageous than my video even",p74c8a,h9hf6ke,puck411,2,conspiracytheories
h9higq6,1629340591.0,local_goon,Who cares it’s just to promote vaccinations. It’s a production. I’m sure he received the jab privately…Does he need to live stream getting his bootyhole fingered to promote prostates checks too?,p74c8a,p74c8a,iimrwanz,1,conspiracytheories
h9hp26e,1629343993.0,Sloppy_Waffler,No but if you’re going to promote something then why fake it? There’s plenty of people you could film who want a real one. This just causes threads like this to happen.,p74c8a,h9higq6,local_goon,2,conspiracytheories
h9hp6cx,1629344057.0,dashielk,When youre filming any sort of media spot you are going to do multiple takes. So they probably shot that scene  many times over. Can't give the man a vaccine every single time. ;),p74c8a,p74c8a,iimrwanz,1,conspiracytheories
h9hqkco,1629344830.0,Own_Hyena24,"It doesn’t look like that sort of video, like I doubt he would be messing with his hat if he was worried about having to redo it over and over.",p74c8a,h9hp6cx,dashielk,2,conspiracytheories
h9hebix,1629338559.0,Turbulent_Photo7562,There is a reason the ruling class has not been affected,p74c8a,p74c8a,iimrwanz,1,conspiracytheories
h9hg749,1629339477.0,Wretched_Brittunculi,"Firstly, many have been affected (Trump, Johnson, etc.). But I bet they were fake, right?? And also, since the vaccines have been available, politicians have been vaccinated, so that is a good argument to get jabbed. Good point.",p74c8a,h9hebix,Turbulent_Photo7562,2,conspiracytheories
h9hgyt9,1629339853.0,joejoe07865,Could have already been poked and just making a video,p74c8a,p74c8a,iimrwanz,1,conspiracytheories
h9hp5pn,1629344047.0,Sloppy_Waffler,Ah you mean lying,p74c8a,h9hgyt9,joejoe07865,2,conspiracytheories
h9hu252,1629346857.0,ElLoboLives,the 'other people' who fall for this and go get the shot are the test subjects. while the rich and famous wait and see the test trial,p74c8a,p74c8a,iimrwanz,1,conspiracytheories
h9hkxbf,1629341826.0,Chance-Fox3616,This is what I want,p74c8a,p74c8a,iimrwanz,1,conspiracytheories
h9hqxzg,1629345044.0,Carnizzy,Fill me with fake vaccine pls. I need a card lol,p74c8a,p74c8a,iimrwanz,1,conspiracytheories
h9i19o4,1629351674.0,SuperMaanas,"Don’t be stupid. It’s likely he already got the vaccine.

If this sub ends up like r/conspiracy I swear to fucking god",p74c8a,p74c8a,iimrwanz,1,conspiracytheories
h9i6vg6,1629355978.0,HavocNightrage,"Glad to still see some rational people around here, there's probably a rational reason for this, no conspiracy.",p74c8a,p74c8a,iimrwanz,1,conspiracytheories
h9i88u8,1629357105.0,probablynotzucc,guys you'll never believe this but i think in fast food commercials they don't actually eat a full happy meal per take how deep does this rabbithole go,p74c8a,p74c8a,iimrwanz,1,conspiracytheories
h9igmhr,1629364385.0,StrongLikeBull3,"These people probably got the vaccine long before it was widely available to the public, that’s why they’re not getting the injection in these videos.",p74c8a,p74c8a,iimrwanz,1,conspiracytheories
