ID,Date_utc,Author,Body,Submission,Parent_ID,Parent_Author,Level,Subreddit
haeeae8,1629964745.0,Howiebledsoe,"There is, however, the entire rest of the planet locked down. Do you really think places like Cambodia, Ecuador and New Zealand would allow their economy to abruptly shut down to protect the Weinsteins of the USA?",pbt39z,pbt39z,HuntsSwampRats,1,conspiracytheories
haftboa,1629993826.0,Dspsblyuth,When the global bankers threaten to turn off the money tap they will,pbt39z,haeeae8,Howiebledsoe,2,conspiracytheories
haetza8,1629977481.0,dance_apoptosistic,Shhhhh.... Not logic! Not here!,pbt39z,haeeae8,Howiebledsoe,2,conspiracytheories
hagcytu,1630001517.0,Schmakeltrain3,"My only push back here is that is not longer the USA specifically. It's the ideology that has overtaken the USA and has very much to spread through out the world and become bigger than just ""the US""",pbt39z,haeeae8,Howiebledsoe,2,conspiracytheories
hahn1b7,1630020871.0,archwz_ovruler,It’s possible these people that hold power and influence could have sold out their country and the people they represent for a curtain amount of money by elites that don’t have to worry about money because they could just print out more when they need it. So…,pbt39z,haeeae8,Howiebledsoe,2,conspiracytheories
hagrkj4,1630007394.0,Fredtzu,"Ecuador sure locked up I have lots of family there, including a late uncle who died from the disease... Dude they we're literally piling corpses outside on the street, because there was absolutely no throughput on crematoriums to cremate the elderly people who were dying. Not saying the pizza gate/ epstein thing was an hoax, but one thing doesn't implicate the other necessarily",pbt39z,haeeae8,Howiebledsoe,2,conspiracytheories
haf6lqe,1629984288.0,_ThrillCollins,"If there are financial incentives involved, it's likely.",pbt39z,haeeae8,Howiebledsoe,2,conspiracytheories
haevs64,1629978593.0,ElRetardio,"Because all these countries got the lockdown idea spontaniously by themselves. Right??

It’s not like there’s internationl pressure and the like for it.. right??

It’s not like the power of the political elite spans all over the globe. Right?? 

Nope, lets reduce this to ”uh buh epstein is only usa mmmbbuuuhhhh”",pbt39z,haeeae8,Howiebledsoe,2,conspiracytheories
hagxg7r,1630009772.0,ChiseledTwinkie,"They would if the U.S. intentionally released a crazy infectious virus, all sponsored by China. China also has an aging population and this virus is mostly dangerous to the elderly beyond retirement age. 2 birds, 1 stone",pbt39z,haeeae8,Howiebledsoe,2,conspiracytheories
hahij2o,1630018792.0,the_awkward_hippie,"Absolutely. Since they are protecting themselves as well. Have you seen Epstein's ""little black book""? Multiple countries are represented in that book. Many are heads of state.",pbt39z,haeeae8,Howiebledsoe,2,conspiracytheories
haf3rdc,1629982924.0,TurnipSwagger,That is correct. The entire world can only do 1 thing at the time. So it was either Epstein or Covid.,pbt39z,pbt39z,HuntsSwampRats,1,conspiracytheories
hafd66s,1629987218.0,thescopeoflife,"Because, once again, the entire world revolves around the US and every other country on earth is just theatre to y'all",pbt39z,pbt39z,HuntsSwampRats,1,conspiracytheories
hafr1tf,1629992930.0,goodbye9hello10,This is the dumbest shit I've ever heard here I think.,pbt39z,pbt39z,HuntsSwampRats,1,conspiracytheories
hafs7pw,1629993386.0,HuntsSwampRats,Small minded thinker here,pbt39z,hafr1tf,goodbye9hello10,2,conspiracytheories
haf95qo,1629985461.0,GirlNumber20,"What was the bubonic plague outbreak of 1346 used as a distraction for?

Come on, if no illnesses happen in humans organically, then it must have been a distraction for something.

Maybe the Epstein scandal was used as a distraction while billionaires and politicians continued to rob the lower classes of their wealth while consigning them to a lifetime of wage servitude. And you fell for it. :(",pbt39z,pbt39z,HuntsSwampRats,1,conspiracytheories
hafdmdx,1629987410.0,thescopeoflife,"the bubonic plague outbreak of 1346 was planned in advance to authenticate covid 700 years later, obviously /s",pbt39z,haf95qo,GirlNumber20,2,conspiracytheories
hafp5wi,1629992175.0,getgankednoob,Bubonic plague was a real pandemic . Bodies piled up on the street . You walked past someone and then drop dead the next day . This isn’t the case with Covid . Not even close,pbt39z,haf95qo,GirlNumber20,2,conspiracytheories
hagmodn,1630005436.0,wermad,Yep. Notice how they managed to get the whole world involved. I'll tell my dead cousin in Chile. Definitely illuminati space lizards,pbt39z,pbt39z,HuntsSwampRats,1,conspiracytheories
haeeape,1629964752.0,Howiebledsoe,"There is, however, the entire rest of the planet locked down. Do you really think places like Cambodia, Ecuador and New Zealand would allow their economy to abruptly shut down to protect the Weinsteins of the USA?",pbt39z,pbt39z,HuntsSwampRats,1,conspiracytheories
haeeqxe,1629965131.0,HuntsSwampRats,"Bro. Each government has there Roman circus. They will do anything to stop the collapse of the circus. The circus provides a distraction to the peasants. Regardless of location they all work the same way. Sports, social media, entertainment, movies, etc. these are all distractions. If the peasants didn’t have them they might start asking questions or go looking for answers, rather then getting drunk and watching the game.",pbt39z,haeeape,Howiebledsoe,2,conspiracytheories
haf0vpx,1629981464.0,runningdownastream,The CDC is corrupt. The whole world follows the CDC. Each country has corrupt leaders. The corrupt leaders have globalist allegiances due to the scale of blackmail run by people like Epstein. This isn't about money.  They can print money.. as much as they want. This is about power. Its about to get dark. Watch Australia.,pbt39z,haeeape,Howiebledsoe,2,conspiracytheories
haezloh,1629980780.0,Tin_Philosopher,"Something something foundations of geopolitics.

Who would be interested in rabble rousing the American public and interfering with elections and prolonging a pandemic and generally eroding the public trust. 

Probably just antifa trying to steal your bibles for the gay frogs.",pbt39z,pbt39z,HuntsSwampRats,1,conspiracytheories
hafbcp0,1629986425.0,doodoowithsprinkles,Nobody cared about Epstein.  There was no need for a distraction.,pbt39z,pbt39z,HuntsSwampRats,1,conspiracytheories
hafizz8,1629989637.0,Bathroom-Afraid,We can do more than one thing at a time.,pbt39z,pbt39z,HuntsSwampRats,1,conspiracytheories
hae3aye,1629956306.0,slipknot_official,"It worked to keep the focus off Trump's Epstein connection. Well, kinda.",pbt39z,pbt39z,HuntsSwampRats,1,conspiracytheories
hae9yqs,1629961243.0,HuntsSwampRats,"Funny how none of the actors or celebrities on the Lolita express came out and said, “gee I had no idea that was going on there!? How can I help make this right?” . . . 

There all quiet hoping it blows over.",pbt39z,hae3aye,slipknot_official,2,conspiracytheories
hae9kxf,1629960939.0,Vicgar06,"I think if there was truth to trump and epstein island, that news would have broke faster than shit from a goose. Way go with a fake dossier or Ukraine when you got the epstein island card?

I'm more curious right now about McAffee and his “suicide”. Did his “dead man switch” get activated or countered?",pbt39z,hae3aye,slipknot_official,2,conspiracytheories
hag0lvr,1629996694.0,Nomandate,This is dumb. The case against Maxwell is progressing daily. Sub to /r/Epstein if you want to stay in-the-know.,pbt39z,pbt39z,HuntsSwampRats,1,conspiracytheories
hah9var,1630014932.0,mikekettz,This is the kind of content I come here for,pbt39z,pbt39z,HuntsSwampRats,1,conspiracytheories
hae6832,1629958402.0,Lockdownlifegrow,I’ve legit thought this for a while now and we haven’t heard a thing about the chick who was working with him to bring the kids in. Bit of a coincidence really,pbt39z,pbt39z,HuntsSwampRats,1,conspiracytheories
hae7slt,1629959576.0,Gedadahear,"On the epstein sub, there are regular updates on her court cases and other things related to epstein",pbt39z,hae6832,Lockdownlifegrow,2,conspiracytheories
hag8wpb,1629999902.0,rivershimmer,"In part because there's not much to update. The legal process grinds along in its usual painfully slow manner. Her trial starts in November. Until then, nothing much is going on.",pbt39z,hae6832,Lockdownlifegrow,2,conspiracytheories
haf0eg8,1629981209.0,runningdownastream,"It's far more sinister than that. The planetary lockdown was planned decades ago. You will have to do your own research to determine this, but I guarantee the proof of this being all fully planned out and scheduled and executed is available. All other wars are planned as well. We are in the middle of a war game. Information World war 3 is a live drill ongoing, exercise.. involving world wide organizations. The CDC, world economic forum, Gates Foundation, John Hopkins, all played a role in the design of this scamdemic. The truth about the PCR test and the isolation of the virus will eventually be exposed. Biggest psyop ever run. Most countries have no idea, they just follow the CDC lies. The globalists are attempting to create world wide medical tyranny with Chinese style social credit slavery for life by lying about germ theory covid forever. Build your immunity. Do not take that shot, no matter what and incredible things, although difficult will happen for you.",pbt39z,pbt39z,HuntsSwampRats,1,conspiracytheories
hafdhbz,1629987350.0,thescopeoflife,"you will have to do your own research a.k.a. trust be bro cuz my proof is horseshit

it's so available, you can't even link it",pbt39z,haf0eg8,runningdownastream,2,conspiracytheories
haf16wu,1629981626.0,LingonberryParking20,"I wonder if Covid was Epstein’s kill switch. Gates was helping Epstien fund Harvard and MIT labs after Epstien was convicted the first time. We know that. We also know that Harvard and MIT scientists were taking CCP money and that Gates along with Google and NIH were funding the GOF lab in Wuhan . Epstein, Gates ,China ,TV doctor Anthony Fauci a global transhumanist criminal network",pbt39z,pbt39z,HuntsSwampRats,1,conspiracytheories
haganii,1630000587.0,Mamasan-,"Bears, Beets, Battlestar Galactica",pbt39z,haf16wu,LingonberryParking20,2,conspiracytheories
haf8ish,1629985172.0,No-Construction4228,"I think that why Epstein never faced consequences all that time ago. The wheels he was greasing for genomic research were too important back then to lose, so insanely illegal deals and no disclosures were made in order to disappear the scandal as quickly as possible. 

CCP/China/whatever you want to call that cabal- their asset and kill switch has been hiding in plain sight this whole time- Virginia and Robert Giuffre.",pbt39z,haf16wu,LingonberryParking20,2,conspiracytheories
haf9i7w,1629985617.0,mas2053,Flip side here. Do you really think the rich and powerful here and England really cares what happens to the rest of the world? I think they would do what ever it took to protect themselves even if it meant destroying the world. Just a thought though I have no idea really.,pbt39z,pbt39z,HuntsSwampRats,1,conspiracytheories
hafanw0,1629986127.0,pfcypress,"Good point but this ""Roman Circus"" will never fall. EVER",pbt39z,pbt39z,HuntsSwampRats,1,conspiracytheories
hafep4m,1629987868.0,manu0872,"The island adventures and the italian food extravaganza, all got blown over by the virus ""catastrophe"", and as a bonus they got Drump out of office.",pbt39z,pbt39z,HuntsSwampRats,1,conspiracytheories
hafmxic,1629991265.0,AFXC1,"Not just Epstein but the entire global human trafficking ring. Remember the Wayfair thing? Or the numerous social media cases of human traffickers being arrested, caught on camera, etc.",pbt39z,pbt39z,HuntsSwampRats,1,conspiracytheories
hafy75z,1629995757.0,earthboundmissfit,"Yep! I'm binge watching Evil on Netflix's and they totally throw down the Epstein did not kill him self truth! It was awesome and effing gutsy! ""He was smothered with a pillow because he had info to take down high-powered people."" 

Great show btw.",pbt39z,pbt39z,HuntsSwampRats,1,conspiracytheories
hag3f87,1629997781.0,MK-Ultra-neuralink,And to cover up growing anger toward Wall Street and record levels of unemployment.,pbt39z,pbt39z,HuntsSwampRats,1,conspiracytheories
hageaj9,1630002049.0,PennTex1988,"I dont see how you can connect Epstein and the 'Rona Virus....

Epstein and all of this is a little phytoplankton in a giant ocean of shit that is wrong with this world.  I really think that fucker did kill himself.  He was such a narcissistic piece of shit that he could not fathom ""losing"" or being brought to shame so he offed himself.",pbt39z,pbt39z,HuntsSwampRats,1,conspiracytheories
hah4wt4,1630012832.0,Aeroblazer9161,Reaching here bro.,pbt39z,pbt39z,HuntsSwampRats,1,conspiracytheories
hahb8k6,1630015526.0,WayofHatuey,Lmao,pbt39z,pbt39z,HuntsSwampRats,1,conspiracytheories
hai5kbo,1630029638.0,Wonderful_Hospital44,"Eh. They had successfully buried the Epstein story before, no reason why they couldn't do it again.",pbt39z,pbt39z,HuntsSwampRats,1,conspiracytheories
haexywp,1629979874.0,Guilty_Assignment_25,"Also a great way for China to geopolitically flex on everybody in the West, have the WHO and UN bend over backwards to kiss their ass for most of the pandemic, and distract us from their colonialist moves in Africa as well as their repression against Uighurs and Hong Kong. 

This whole thing likely stood to benefit a lot of really fucking warped people in a lot of ways. Being the perfect excuse to sweep a massive global pedo ring under the rug is just one of many imo.",pbt39z,pbt39z,HuntsSwampRats,1,conspiracytheories
haf1uea,1629981964.0,runningdownastream,"Yep. China is the globalists social experiment and they will attempt to use China as a model and as the dominate country to usher in a surveillance style permanent medical tyranny system to each and every country by 2030. Hollywood is owned by CCP fronting globalists, as is the corporate media, as is the majority of DC. The house of cards is coming down, and we have helpful alliances trying to redirect this attack and resolve through exposure and war gaming.. but how this all plays out, how they try to clean it all up and what that all looks like will be insane.",pbt39z,haexywp,Guilty_Assignment_25,2,conspiracytheories
hafrohl,1629993177.0,TiitanX,"Edit: he is unbanned now with a spam warning. It was always just about the spam, and we worked past it together. ❤️",pbkwb6,pbkwb6,Fluid_Source-2021,1,conspiracytheories
hacg6ut,1629927391.0,slipknot_official,Banned for criticizing capitalism. What's this world coming to?,pbkwb6,pbkwb6,Fluid_Source-2021,1,conspiracytheories
habuqgv,1629918781.0,AnyWoman69,The sad truth is none of us general public are genetically interesting enough to bother spending the money on gathering DNA samples of. If they’re taking DNA samples it’s of athletes and the top 1% intelligent. Some of them would even donate a sample of their DNA for free.,pbhs9m,pbhs9m,SCyeti420,1,conspiracytheories
habvz8k,1629919274.0,SCyeti420,"Suppose you were a wanted felon and you got sick and thought you had Covid. You go to get tested. You have to give your name, address, phone #, etc to get an appointment for a test. Well, then it would be a matter of a couple days before you got scooped up because you would be told to stay in your home until your test results. 
The Ancestry websites are  already a source for this database.
https://www.forbes.com/sites/thomasbrewster/2020/02/04/ancestry-fights-the-us-government-as-feds-try-to-grab-dna-data/",pbhs9m,habuqgv,AnyWoman69,2,conspiracytheories
habvto1,1629919214.0,Legaltaway12," Not sure of your source, but it is definitely plausible... The same is said about commercial DNA tests",pbhs9m,pbhs9m,SCyeti420,1,conspiracytheories
ha6rfdp,1629827132.0,SirFluffymuffin,"The way the vaccines are working right now and with the new strains means that it isn’t a 100% thing. A 98% effective rate means that their is still a 2% chance it doesn’t work. When you have a pandemic, that 2% could mean millions could get infected. Add to that the mutations that further reduce the effectiveness of the vaccines and it’s a reasonable thing to be worried about, especially when you are in close contact with the especially at risk populations. That’s why herd immunity is a thing that has been pushed, essentially starving the virus of hosts so it can’t survive and adapt to what we are doing and dragging it out for years and years. The more people bitch about it and don’t vaccinate, the further we are from herd immunity and the longer this shit show drags on and the more people die from something that shouldn’t have gotten to that point 10 years down the line",paruvo,paruvo,,1,conspiracytheories
ha6syr6,1629827730.0,The1FreeMan420,Imagine if a World power wanted to control a population. The final step was to register everyone in order to introduce total control. What about problem-reaction-solution? Release a virus. Mandate the vaccine. Certain individuals and organizations stand to make trillions. And vaccine passports? Show me your papers? What ever happened to heard immunity? Trading freedom for security? I've seen enough of the MSM to know they are indeed a propaganda machine. How can ppl not be aware of the fear they are experiencing and how it changes the thought process and decisions making? Why does everyone just either go along with what they are told or go so strongly against it (seemingly) ? There's too much that has happened and is happening to allow any sort of trust to the world powers. No one who gets the shot that I know question things at all. WHY THE FEAR?,paruvo,ha6rfdp,SirFluffymuffin,2,conspiracytheories
ha6utwn,1629828467.0,HowCanThisBeMyGenX,And the more likely that soon we’ll get a COVID19 mutation so dangerous that it makes the delta variant look like nothing.,paruvo,ha6rfdp,SirFluffymuffin,2,conspiracytheories
ha6pwci,1629826527.0,ActualAdvice,"They have children/elderly/immunocompromised family who are unvaccinated?

The fact that the vaccine doesn’t make you immune just less likely/severe?

They know you are a higher chance of having/spreading the virus?

You are free to not get the vaccine based on your beliefs.

They are free not to want to be near you based on their beliefs.

Get new friends or wait for them to change their mind.

Your friends not wanting to be friends based on your vaccination status is NOT a conspiracy.",paruvo,paruvo,,1,conspiracytheories
ha6qfqd,1629826741.0,The1FreeMan420,What about ppl making decisions out of fear based on information from an entity that has proven time and time again that they cannot be trusted to have humanities best interests at heart?,paruvo,ha6pwci,ActualAdvice,2,conspiracytheories
ha6r0e5,1629826969.0,The1FreeMan420,I'm talking more about the fear mongering and hateful segregation of our society. People who fear cannot think rationally or objectively.,paruvo,ha6pwci,ActualAdvice,2,conspiracytheories
ha6xey0,1629829484.0,onyxaj,">The fact that the vaccine doesn’t make you immune just less likely/severe?

Vaccine definition - ""a substance used to stimulate the production of antibodies and provide immunity against one or several diseases, prepared from the causative agent of a disease, its products, or a synthetic substitute, treated to act as an antigen without inducing the disease.""

It's not a vaccine then.",paruvo,ha6pwci,ActualAdvice,2,conspiracytheories
ha6qnag,1629826824.0,AnyWoman69,Because you have a vaccine against something doesn’t mean you can’t still host the virus and pass it on to others. They got vaccinated because they believe it’s the right thing to do and are acting like they are because they believe that’s the right thing to do too.,paruvo,paruvo,,1,conspiracytheories
ha6pr7o,1629826472.0,Jaysin82,Just because someone is vaccinated doesn't mean they still can't get covered. Also if they have young children who are not able to be vaccinated you are putting their children at risk.,paruvo,paruvo,,1,conspiracytheories
ha70i8z,1629830697.0,zmoore1983,"Children are not at risk, their chance of dying from Covid rounds to 0%. The Flu kills more kids.",paruvo,ha6pr7o,Jaysin82,2,conspiracytheories
ha6uka9,1629828360.0,HowCanThisBeMyGenX,"Many people have at least 1 person in their family who can’t get vaccinated or isn’t old enough.  People who are vaccinated can catch the virus and carry it home to their unvaccinated loved ones.  There isn’t sufficient percentage of people vaccinated yet for people overall to relax.   The longer we go through this significant resistance to getting the COVID vaccine the higher the chance that we’ll get a new, worse more dangerous mutation than the delta variant.",paruvo,paruvo,,1,conspiracytheories
ha6y1ji,1629829728.0,Houghs,So just more unsubstantiated circular reasoning with no logic?,paruvo,ha6uka9,HowCanThisBeMyGenX,2,conspiracytheories
ha6vza3,1629828929.0,TurnipSwagger,An anti-vaxxer who doesn't understand viruses and vaccines? Weird.,paruvo,paruvo,,1,conspiracytheories
ha70k6b,1629830718.0,The1FreeMan420,Someone who questions the covid vaccine is now anti vax? This is always the typical response. Why don't you teach what you know and spread some knowledge instead of making passive aggressive comments,paruvo,ha6vza3,TurnipSwagger,2,conspiracytheories
ha72mgr,1629831503.0,WeirdCupcake6942,Do you understand how viruses work? lol,paruvo,ha6vza3,TurnipSwagger,2,conspiracytheories
ha6souy,1629827622.0,pawneshoppe,"they’re just also seeing all of the statistics and articles and anecdotal information about people getting sick who have the vaccine so they don’t really know what’s happening.  
they were told that the vaccine worked, something I have yet to see any proof of within my age group (18-29), and now that it’s not actually preventing anything they need someone to blame it on because they can’t blame the people feeding them nonsense on a daily basis. mainly because without the news and social media these people would be lost. 

so it’s easier to blame it on regular people rather than “elites”. it’s just planned division, like almost everything else nowadays.",paruvo,paruvo,,1,conspiracytheories
ha6tqii,1629828033.0,The1FreeMan420,Nice answer. That makes a lot of sense. Has this sort of thing already happened in the last? Maybe not in the context of a virus. Maybe a dictator or tyrant perhaps?,paruvo,ha6souy,pawneshoppe,2,conspiracytheories
ha70jm8,1629830712.0,vester71,"This whole thing blows my mind.

Vaccinated are afraid of unvaccinated, even though they are vaccinated.

Vaccinated can catch and spread covid just like unvaccinated.

People that have actually had covid and recovered are still being told to get vaccinated, because the narrative is that natural immunity doesn't work, even though vaccine doesn't work either.",paruvo,paruvo,,1,conspiracytheories
ha6ova0,1629826124.0,truthspeaklisten,"I wish I had an answer for you.  Those people are not thinking, simply repeating what they hear.  Been too busy to think for too long.  Whenever they open with “I’ve had both shots”, my response is “awesome, so you don’t have to worry about getting it anymore.”  They usually have an uncomfortable agreeable smile and the topic ends there.  😂😇",paruvo,paruvo,,1,conspiracytheories
ha6vaho,1629828651.0,HowCanThisBeMyGenX,"You didn’t pay attention in science in school, did you.",paruvo,ha6ova0,truthspeaklisten,2,conspiracytheories
ha6q1vs,1629826588.0,gantzu90,Some Jedi mind tricks right there,paruvo,ha6ova0,truthspeaklisten,2,conspiracytheories
ha6qyu8,1629826952.0,BlackCoates,Because they know that the CDC propaganda they believed back in March isn't true🤷‍♂️,paruvo,paruvo,,1,conspiracytheories
ha6setf,1629827513.0,MidpackRacer,"Which why hospitals are filling up with the unvaccinated, right?",paruvo,ha6qyu8,BlackCoates,2,conspiracytheories
ha6v0i6,1629828540.0,BlackCoates,https://citizenfreepress.com/breaking/never-trust-rochelle-walensky/,paruvo,paruvo,,1,conspiracytheories
ha716hg,1629830957.0,The1FreeMan420,"LoL, this is what I mean about trusting these people.",paruvo,ha6v0i6,BlackCoates,2,conspiracytheories
ha6x34y,1629829356.0,Josette22,Please tell your friends and family that the current consensus is that those who are vaccinated can more easily give it to those who are unvaccinated.  That news is what's been floating around on social media.,paruvo,paruvo,,1,conspiracytheories
ha709ax,1629830601.0,lildickbleed01,I often wonder the same thing about the vaccinated.,paruvo,paruvo,,1,conspiracytheories
ha719nq,1629830990.0,KenHutchenson,"I’m going to say this as gently as possible: You need to go see a therapist. Your post, comments and replies scream paranoia.

It’s been a rough 18 months. Treat yourself to a head shrink. No shame in that.",paruvo,paruvo,,1,conspiracytheories
ha7cfl7,1629835407.0,The1FreeMan420,Ad hominem? A shrink is a psychologist vs a therapist? Which is it? And who are you referring to anyway? And on a conspiracy theory sub? Shiiit,paruvo,ha719nq,KenHutchenson,2,conspiracytheories
ha71dov,1629831032.0,Efficient_Attitude96,I don't need to trust anyone other than my own immune system.,paruvo,paruvo,,1,conspiracytheories
ha741kl,1629832056.0,stodolak,Get the vaccine.,paruvo,paruvo,,1,conspiracytheories
ha7e78f,1629836116.0,The1FreeMan420,Why,paruvo,ha741kl,stodolak,2,conspiracytheories
ha6wuvl,1629829266.0,Irrational-actor,Fuuuuuuuuuuuuuck NO,paruvo,paruvo,,1,conspiracytheories
ha717yu,1629830973.0,The1FreeMan420,Eh?,paruvo,ha6wuvl,Irrational-actor,2,conspiracytheories
ha59dmc,1629801417.0,tc_spears,"Was it discovered by Doctorprofessor Ted Nugent?

https://www.spin.com/2021/04/ted-nugent-covid-19-facebook-live/",pakhxw,pakhxw,BeigeListed,1,conspiracytheories
